wandb: Currently logged in as: hungtrab (hungtrab-hanoi-university-of-science-and-technology) to https://api.wandb.ai. Use `wandb login --relogin` to force relogin
wandb: setting up run d0mu5meg
wandb: Tracking run with wandb version 0.23.1
wandb: Run data is saved locally in logs/CartPole_gravity_jump_Baseline_20251217_125255/wandb/run-20251217_125258-d0mu5meg
wandb: Run `wandb offline` to turn off syncing.
wandb: Syncing run CartPole_gravity_jump_Baseline_20251217_125255
wandb: ⭐️ View project at https://wandb.ai/hungtrab-hanoi-university-of-science-and-technology/CartPole_Drift_Research_TRPO
wandb: 🚀 View run at https://wandb.ai/hungtrab-hanoi-university-of-science-and-technology/CartPole_Drift_Research_TRPO/runs/d0mu5meg
/home/hungchan/miniconda3/envs/rl_hf_course/lib/python3.10/site-packages/stable_baselines3/common/on_policy_algorithm.py:150: UserWarning: You are trying to run TRPO on the GPU, but it is primarily intended to run on the CPU when not using a CNN policy (you are using ActorCriticPolicy which should be a MlpPolicy). See https://github.com/DLR-RM/stable-baselines3/issues/1245 for more info. You can pass `device='cpu'` or `export CUDA_VISIBLE_DEVICES=` to force using the CPU.Note: The model will train, but the GPU utilization will be poor and the training might take longer than on CPU.
  warnings.warn(
--- Training Start: CartPole_gravity_jump_Baseline_20251217_125255 ---
>>> [Wrapper] Initialized Non-Stationary CartPole
    - gravity: jump (magnitude=10.0, period=50000)
>>> Initializing TRPO with kwargs: ['policy', 'env', 'learning_rate', 'gamma', 'verbose', 'tensorboard_log', 'n_steps', 'batch_size']
Using cuda device
Wrapping the env in a DummyVecEnv.
Logging to logs/CartPole_gravity_jump_Baseline_20251217_125255_0
---------------------------------
| rollout/           |          |
|    ep_len_mean     | 21       |
|    ep_rew_mean     | 21       |
| time/              |          |
|    fps             | 1365     |
|    iterations      | 1        |
|    time_elapsed    | 1        |
|    total_timesteps | 2048     |
---------------------------------
----------------------------------------
| rollout/                  |          |
|    ep_len_mean            | 24.7     |
|    ep_rew_mean            | 24.7     |
| time/                     |          |
|    fps                    | 1317     |
|    iterations             | 2        |
|    time_elapsed           | 3        |
|    total_timesteps        | 4096     |
| train/                    |          |
|    explained_variance     | -0.00253 |
|    is_line_search_success | 1        |
|    kl_divergence_loss     | 0.00827  |
|    learning_rate          | 0.0003   |
|    n_updates              | 1        |
|    policy_objective       | 0.0155   |
|    value_loss             | 44.9     |
----------------------------------------
----------------------------------------
| rollout/                  |          |
|    ep_len_mean            | 34.9     |
|    ep_rew_mean            | 34.9     |
| time/                     |          |
|    fps                    | 1319     |
|    iterations             | 3        |
|    time_elapsed           | 4        |
|    total_timesteps        | 6144     |
| train/                    |          |
|    explained_variance     | 0.0769   |
|    is_line_search_success | 1        |
|    kl_divergence_loss     | 0.00835  |
|    learning_rate          | 0.0003   |
|    n_updates              | 2        |
|    policy_objective       | 0.0206   |
|    value_loss             | 32.9     |
----------------------------------------
----------------------------------------
| rollout/                  |          |
|    ep_len_mean            | 46.6     |
|    ep_rew_mean            | 46.6     |
| time/                     |          |
|    fps                    | 1324     |
|    iterations             | 4        |
|    time_elapsed           | 6        |
|    total_timesteps        | 8192     |
| train/                    |          |
|    explained_variance     | 0.182    |
|    is_line_search_success | 1        |
|    kl_divergence_loss     | 0.00784  |
|    learning_rate          | 0.0003   |
|    n_updates              | 3        |
|    policy_objective       | 0.0233   |
|    value_loss             | 54       |
----------------------------------------
----------------------------------------
| rollout/                  |          |
|    ep_len_mean            | 57.5     |
|    ep_rew_mean            | 57.5     |
| time/                     |          |
|    fps                    | 1334     |
|    iterations             | 5        |
|    time_elapsed           | 7        |
|    total_timesteps        | 10240    |
| train/                    |          |
|    explained_variance     | 0.195    |
|    is_line_search_success | 1        |
|    kl_divergence_loss     | 0.00745  |
|    learning_rate          | 0.0003   |
|    n_updates              | 4        |
|    policy_objective       | 0.0223   |
|    value_loss             | 67       |
----------------------------------------
----------------------------------------
| rollout/                  |          |
|    ep_len_mean            | 73.6     |
|    ep_rew_mean            | 73.6     |
| time/                     |          |
|    fps                    | 1337     |
|    iterations             | 6        |
|    time_elapsed           | 9        |
|    total_timesteps        | 12288    |
| train/                    |          |
|    explained_variance     | 0.213    |
|    is_line_search_success | 1        |
|    kl_divergence_loss     | 0.00715  |
|    learning_rate          | 0.0003   |
|    n_updates              | 5        |
|    policy_objective       | 0.027    |
|    value_loss             | 81.2     |
----------------------------------------
----------------------------------------
| rollout/                  |          |
|    ep_len_mean            | 88.2     |
|    ep_rew_mean            | 88.2     |
| time/                     |          |
|    fps                    | 1337     |
|    iterations             | 7        |
|    time_elapsed           | 10       |
|    total_timesteps        | 14336    |
| train/                    |          |
|    explained_variance     | 0.0954   |
|    is_line_search_success | 1        |
|    kl_divergence_loss     | 0.00677  |
|    learning_rate          | 0.0003   |
|    n_updates              | 6        |
|    policy_objective       | 0.0193   |
|    value_loss             | 60.9     |
----------------------------------------
----------------------------------------
| rollout/                  |          |
|    ep_len_mean            | 106      |
|    ep_rew_mean            | 106      |
| time/                     |          |
|    fps                    | 1338     |
|    iterations             | 8        |
|    time_elapsed           | 12       |
|    total_timesteps        | 16384    |
| train/                    |          |
|    explained_variance     | 0.634    |
|    is_line_search_success | 1        |
|    kl_divergence_loss     | 0.00794  |
|    learning_rate          | 0.0003   |
|    n_updates              | 7        |
|    policy_objective       | 0.0163   |
|    value_loss             | 35.2     |
----------------------------------------
----------------------------------------
| rollout/                  |          |
|    ep_len_mean            | 122      |
|    ep_rew_mean            | 122      |
| time/                     |          |
|    fps                    | 1333     |
|    iterations             | 9        |
|    time_elapsed           | 13       |
|    total_timesteps        | 18432    |
| train/                    |          |
|    explained_variance     | 0.729    |
|    is_line_search_success | 1        |
|    kl_divergence_loss     | 0.00746  |
|    learning_rate          | 0.0003   |
|    n_updates              | 8        |
|    policy_objective       | 0.0158   |
|    value_loss             | 28.7     |
----------------------------------------
----------------------------------------
| rollout/                  |          |
|    ep_len_mean            | 140      |
|    ep_rew_mean            | 140      |
| time/                     |          |
|    fps                    | 1336     |
|    iterations             | 10       |
|    time_elapsed           | 15       |
|    total_timesteps        | 20480    |
| train/                    |          |
|    explained_variance     | 0.826    |
|    is_line_search_success | 1        |
|    kl_divergence_loss     | 0.00799  |
|    learning_rate          | 0.0003   |
|    n_updates              | 9        |
|    policy_objective       | 0.0117   |
|    value_loss             | 31.5     |
----------------------------------------
----------------------------------------
| rollout/                  |          |
|    ep_len_mean            | 157      |
|    ep_rew_mean            | 157      |
| time/                     |          |
|    fps                    | 1335     |
|    iterations             | 11       |
|    time_elapsed           | 16       |
|    total_timesteps        | 22528    |
| train/                    |          |
|    explained_variance     | 0.898    |
|    is_line_search_success | 1        |
|    kl_divergence_loss     | 0.00645  |
|    learning_rate          | 0.0003   |
|    n_updates              | 10       |
|    policy_objective       | 0.0148   |
|    value_loss             | 25.2     |
----------------------------------------
----------------------------------------
| rollout/                  |          |
|    ep_len_mean            | 170      |
|    ep_rew_mean            | 170      |
| time/                     |          |
|    fps                    | 1335     |
|    iterations             | 12       |
|    time_elapsed           | 18       |
|    total_timesteps        | 24576    |
| train/                    |          |
|    explained_variance     | 0.959    |
|    is_line_search_success | 1        |
|    kl_divergence_loss     | 0.00773  |
|    learning_rate          | 0.0003   |
|    n_updates              | 11       |
|    policy_objective       | 0.00701  |
|    value_loss             | 10       |
----------------------------------------
----------------------------------------
| rollout/                  |          |
|    ep_len_mean            | 191      |
|    ep_rew_mean            | 191      |
| time/                     |          |
|    fps                    | 1334     |
|    iterations             | 13       |
|    time_elapsed           | 19       |
|    total_timesteps        | 26624    |
| train/                    |          |
|    explained_variance     | 0.97     |
|    is_line_search_success | 1        |
|    kl_divergence_loss     | 0.00758  |
|    learning_rate          | 0.0003   |
|    n_updates              | 12       |
|    policy_objective       | 0.0106   |
|    value_loss             | 6.97     |
----------------------------------------
----------------------------------------
| rollout/                  |          |
|    ep_len_mean            | 208      |
|    ep_rew_mean            | 208      |
| time/                     |          |
|    fps                    | 1333     |
|    iterations             | 14       |
|    time_elapsed           | 21       |
|    total_timesteps        | 28672    |
| train/                    |          |
|    explained_variance     | 0.978    |
|    is_line_search_success | 1        |
|    kl_divergence_loss     | 0.00936  |
|    learning_rate          | 0.0003   |
|    n_updates              | 13       |
|    policy_objective       | 0.0187   |
|    value_loss             | 5.4      |
----------------------------------------
----------------------------------------
| rollout/                  |          |
|    ep_len_mean            | 225      |
|    ep_rew_mean            | 225      |
| time/                     |          |
|    fps                    | 1334     |
|    iterations             | 15       |
|    time_elapsed           | 23       |
|    total_timesteps        | 30720    |
| train/                    |          |
|    explained_variance     | 0.676    |
|    is_line_search_success | 1        |
|    kl_divergence_loss     | 0.00763  |
|    learning_rate          | 0.0003   |
|    n_updates              | 14       |
|    policy_objective       | 0.0193   |
|    value_loss             | 30.1     |
----------------------------------------
----------------------------------------
| rollout/                  |          |
|    ep_len_mean            | 242      |
|    ep_rew_mean            | 242      |
| time/                     |          |
|    fps                    | 1333     |
|    iterations             | 16       |
|    time_elapsed           | 24       |
|    total_timesteps        | 32768    |
| train/                    |          |
|    explained_variance     | 0.618    |
|    is_line_search_success | 1        |
|    kl_divergence_loss     | 0.00873  |
|    learning_rate          | 0.0003   |
|    n_updates              | 15       |
|    policy_objective       | 0.00527  |
|    value_loss             | 2.35     |
----------------------------------------
----------------------------------------
| rollout/                  |          |
|    ep_len_mean            | 263      |
|    ep_rew_mean            | 263      |
| time/                     |          |
|    fps                    | 1331     |
|    iterations             | 17       |
|    time_elapsed           | 26       |
|    total_timesteps        | 34816    |
| train/                    |          |
|    explained_variance     | -0.0191  |
|    is_line_search_success | 1        |
|    kl_divergence_loss     | 0.00796  |
|    learning_rate          | 0.0003   |
|    n_updates              | 16       |
|    policy_objective       | 0.00566  |
|    value_loss             | 1.46     |
----------------------------------------
----------------------------------------
| rollout/                  |          |
|    ep_len_mean            | 279      |
|    ep_rew_mean            | 279      |
| time/                     |          |
|    fps                    | 1331     |
|    iterations             | 18       |
|    time_elapsed           | 27       |
|    total_timesteps        | 36864    |
| train/                    |          |
|    explained_variance     | 0.931    |
|    is_line_search_success | 1        |
|    kl_divergence_loss     | 0.00954  |
|    learning_rate          | 0.0003   |
|    n_updates              | 17       |
|    policy_objective       | 0.0211   |
|    value_loss             | 6.93     |
----------------------------------------
----------------------------------------
| rollout/                  |          |
|    ep_len_mean            | 298      |
|    ep_rew_mean            | 298      |
| time/                     |          |
|    fps                    | 1327     |
|    iterations             | 19       |
|    time_elapsed           | 29       |
|    total_timesteps        | 38912    |
| train/                    |          |
|    explained_variance     | 0.703    |
|    is_line_search_success | 1        |
|    kl_divergence_loss     | 0.00924  |
|    learning_rate          | 0.0003   |
|    n_updates              | 18       |
|    policy_objective       | 0.0169   |
|    value_loss             | 0.681    |
----------------------------------------
----------------------------------------
| rollout/                  |          |
|    ep_len_mean            | 314      |
|    ep_rew_mean            | 314      |
| time/                     |          |
|    fps                    | 1324     |
|    iterations             | 20       |
|    time_elapsed           | 30       |
|    total_timesteps        | 40960    |
| train/                    |          |
|    explained_variance     | 0.0453   |
|    is_line_search_success | 1        |
|    kl_divergence_loss     | 0.00776  |
|    learning_rate          | 0.0003   |
|    n_updates              | 19       |
|    policy_objective       | 0.00724  |
|    value_loss             | 0.416    |
----------------------------------------
----------------------------------------
| rollout/                  |          |
|    ep_len_mean            | 332      |
|    ep_rew_mean            | 332      |
| time/                     |          |
|    fps                    | 1320     |
|    iterations             | 21       |
|    time_elapsed           | 32       |
|    total_timesteps        | 43008    |
| train/                    |          |
|    explained_variance     | -0.0245  |
|    is_line_search_success | 1        |
|    kl_divergence_loss     | 0.0064   |
|    learning_rate          | 0.0003   |
|    n_updates              | 20       |
|    policy_objective       | 0.00744  |
|    value_loss             | 0.268    |
----------------------------------------
----------------------------------------
| rollout/                  |          |
|    ep_len_mean            | 348      |
|    ep_rew_mean            | 348      |
| time/                     |          |
|    fps                    | 1314     |
|    iterations             | 22       |
|    time_elapsed           | 34       |
|    total_timesteps        | 45056    |
| train/                    |          |
|    explained_variance     | -0.0446  |
|    is_line_search_success | 1        |
|    kl_divergence_loss     | 0.00808  |
|    learning_rate          | 0.0003   |
|    n_updates              | 21       |
|    policy_objective       | 0.00375  |
|    value_loss             | 0.172    |
----------------------------------------
----------------------------------------
| rollout/                  |          |
|    ep_len_mean            | 366      |
|    ep_rew_mean            | 366      |
| time/                     |          |
|    fps                    | 1305     |
|    iterations             | 23       |
|    time_elapsed           | 36       |
|    total_timesteps        | 47104    |
| train/                    |          |
|    explained_variance     | -0.0439  |
|    is_line_search_success | 1        |
|    kl_divergence_loss     | 0.00928  |
|    learning_rate          | 0.0003   |
|    n_updates              | 22       |
|    policy_objective       | 0.00501  |
|    value_loss             | 0.111    |
----------------------------------------
----------------------------------------
| rollout/                  |          |
|    ep_len_mean            | 377      |
|    ep_rew_mean            | 377      |
| time/                     |          |
|    fps                    | 1290     |
|    iterations             | 24       |
|    time_elapsed           | 38       |
|    total_timesteps        | 49152    |
| train/                    |          |
|    explained_variance     | 0.24     |
|    is_line_search_success | 1        |
|    kl_divergence_loss     | 0.00594  |
|    learning_rate          | 0.0003   |
|    n_updates              | 23       |
|    policy_objective       | 0.00468  |
|    value_loss             | 0.0719   |
----------------------------------------
----------------------------------------
| rollout/                  |          |
|    ep_len_mean            | 391      |
|    ep_rew_mean            | 391      |
| time/                     |          |
|    fps                    | 1277     |
|    iterations             | 25       |
|    time_elapsed           | 40       |
|    total_timesteps        | 51200    |
| train/                    |          |
|    explained_variance     | 0.00499  |
|    is_line_search_success | 1        |
|    kl_divergence_loss     | 0.00926  |
|    learning_rate          | 0.0003   |
|    n_updates              | 24       |
|    policy_objective       | 0.00815  |
|    value_loss             | 0.0455   |
----------------------------------------
----------------------------------------
| rollout/                  |          |
|    ep_len_mean            | 404      |
|    ep_rew_mean            | 404      |
| time/                     |          |
|    fps                    | 1268     |
|    iterations             | 26       |
|    time_elapsed           | 41       |
|    total_timesteps        | 53248    |
| train/                    |          |
|    explained_variance     | 0.00216  |
|    is_line_search_success | 1        |
|    kl_divergence_loss     | 0.00695  |
|    learning_rate          | 0.0003   |
|    n_updates              | 25       |
|    policy_objective       | 0.0137   |
|    value_loss             | 87.1     |
----------------------------------------
----------------------------------------
| rollout/                  |          |
|    ep_len_mean            | 413      |
|    ep_rew_mean            | 413      |
| time/                     |          |
|    fps                    | 1263     |
|    iterations             | 27       |
|    time_elapsed           | 43       |
|    total_timesteps        | 55296    |
| train/                    |          |
|    explained_variance     | -2.72    |
|    is_line_search_success | 1        |
|    kl_divergence_loss     | 0.00623  |
|    learning_rate          | 0.0003   |
|    n_updates              | 26       |
|    policy_objective       | 0.00676  |
|    value_loss             | 2.65     |
----------------------------------------
----------------------------------------
| rollout/                  |          |
|    ep_len_mean            | 422      |
|    ep_rew_mean            | 422      |
| time/                     |          |
|    fps                    | 1256     |
|    iterations             | 28       |
|    time_elapsed           | 45       |
|    total_timesteps        | 57344    |
| train/                    |          |
|    explained_variance     | -1.02    |
|    is_line_search_success | 1        |
|    kl_divergence_loss     | 0.00612  |
|    learning_rate          | 0.0003   |
|    n_updates              | 27       |
|    policy_objective       | 0.00822  |
|    value_loss             | 0.226    |
----------------------------------------
----------------------------------------
| rollout/                  |          |
|    ep_len_mean            | 432      |
|    ep_rew_mean            | 432      |
| time/                     |          |
|    fps                    | 1255     |
|    iterations             | 29       |
|    time_elapsed           | 47       |
|    total_timesteps        | 59392    |
| train/                    |          |
|    explained_variance     | 0.275    |
|    is_line_search_success | 1        |
|    kl_divergence_loss     | 0.00703  |
|    learning_rate          | 0.0003   |
|    n_updates              | 28       |
|    policy_objective       | 0.0109   |
|    value_loss             | 0.042    |
----------------------------------------
----------------------------------------
| rollout/                  |          |
|    ep_len_mean            | 442      |
|    ep_rew_mean            | 442      |
| time/                     |          |
|    fps                    | 1255     |
|    iterations             | 30       |
|    time_elapsed           | 48       |
|    total_timesteps        | 61440    |
| train/                    |          |
|    explained_variance     | -0.619   |
|    is_line_search_success | 1        |
|    kl_divergence_loss     | 0.00757  |
|    learning_rate          | 0.0003   |
|    n_updates              | 29       |
|    policy_objective       | 0.0172   |
|    value_loss             | 0.0199   |
----------------------------------------
----------------------------------------
| rollout/                  |          |
|    ep_len_mean            | 454      |
|    ep_rew_mean            | 454      |
| time/                     |          |
|    fps                    | 1254     |
|    iterations             | 31       |
|    time_elapsed           | 50       |
|    total_timesteps        | 63488    |
| train/                    |          |
|    explained_variance     | -2       |
|    is_line_search_success | 1        |
|    kl_divergence_loss     | 0.00374  |
|    learning_rate          | 0.0003   |
|    n_updates              | 30       |
|    policy_objective       | 0.00431  |
|    value_loss             | 0.0161   |
----------------------------------------
----------------------------------------
| rollout/                  |          |
|    ep_len_mean            | 466      |
|    ep_rew_mean            | 466      |
| time/                     |          |
|    fps                    | 1254     |
|    iterations             | 32       |
|    time_elapsed           | 52       |
|    total_timesteps        | 65536    |
| train/                    |          |
|    explained_variance     | -2.4     |
|    is_line_search_success | 1        |
|    kl_divergence_loss     | 0.00339  |
|    learning_rate          | 0.0003   |
|    n_updates              | 31       |
|    policy_objective       | 0.00393  |
|    value_loss             | 0.0115   |
----------------------------------------
----------------------------------------
| rollout/                  |          |
|    ep_len_mean            | 473      |
|    ep_rew_mean            | 473      |
| time/                     |          |
|    fps                    | 1254     |
|    iterations             | 33       |
|    time_elapsed           | 53       |
|    total_timesteps        | 67584    |
| train/                    |          |
|    explained_variance     | -2.33    |
|    is_line_search_success | 1        |
|    kl_divergence_loss     | 0.00626  |
|    learning_rate          | 0.0003   |
|    n_updates              | 32       |
|    policy_objective       | 0.00659  |
|    value_loss             | 0.00731  |
----------------------------------------
----------------------------------------
| rollout/                  |          |
|    ep_len_mean            | 480      |
|    ep_rew_mean            | 480      |
| time/                     |          |
|    fps                    | 1252     |
|    iterations             | 34       |
|    time_elapsed           | 55       |
|    total_timesteps        | 69632    |
| train/                    |          |
|    explained_variance     | -3.04    |
|    is_line_search_success | 1        |
|    kl_divergence_loss     | 0.00589  |
|    learning_rate          | 0.0003   |
|    n_updates              | 33       |
|    policy_objective       | 0.00309  |
|    value_loss             | 0.00527  |
----------------------------------------
----------------------------------------
| rollout/                  |          |
|    ep_len_mean            | 487      |
|    ep_rew_mean            | 487      |
| time/                     |          |
|    fps                    | 1251     |
|    iterations             | 35       |
|    time_elapsed           | 57       |
|    total_timesteps        | 71680    |
| train/                    |          |
|    explained_variance     | -2.65    |
|    is_line_search_success | 1        |
|    kl_divergence_loss     | 0.00723  |
|    learning_rate          | 0.0003   |
|    n_updates              | 34       |
|    policy_objective       | 0.00635  |
|    value_loss             | 0.00399  |
----------------------------------------
----------------------------------------
| rollout/                  |          |
|    ep_len_mean            | 490      |
|    ep_rew_mean            | 490      |
| time/                     |          |
|    fps                    | 1253     |
|    iterations             | 36       |
|    time_elapsed           | 58       |
|    total_timesteps        | 73728    |
| train/                    |          |
|    explained_variance     | -2.64    |
|    is_line_search_success | 1        |
|    kl_divergence_loss     | 0.00744  |
|    learning_rate          | 0.0003   |
|    n_updates              | 35       |
|    policy_objective       | 0.00462  |
|    value_loss             | 0.00402  |
----------------------------------------
----------------------------------------
| rollout/                  |          |
|    ep_len_mean            | 492      |
|    ep_rew_mean            | 492      |
| time/                     |          |
|    fps                    | 1255     |
|    iterations             | 37       |
|    time_elapsed           | 60       |
|    total_timesteps        | 75776    |
| train/                    |          |
|    explained_variance     | -3.23    |
|    is_line_search_success | 1        |
|    kl_divergence_loss     | 0.00707  |
|    learning_rate          | 0.0003   |
|    n_updates              | 36       |
|    policy_objective       | 0.00468  |
|    value_loss             | 0.00289  |
----------------------------------------
----------------------------------------
| rollout/                  |          |
|    ep_len_mean            | 493      |
|    ep_rew_mean            | 493      |
| time/                     |          |
|    fps                    | 1256     |
|    iterations             | 38       |
|    time_elapsed           | 61       |
|    total_timesteps        | 77824    |
| train/                    |          |
|    explained_variance     | -1.09    |
|    is_line_search_success | 1        |
|    kl_divergence_loss     | 0.00492  |
|    learning_rate          | 0.0003   |
|    n_updates              | 37       |
|    policy_objective       | 0.00239  |
|    value_loss             | 0.0013   |
----------------------------------------
----------------------------------------
| rollout/                  |          |
|    ep_len_mean            | 493      |
|    ep_rew_mean            | 493      |
| time/                     |          |
|    fps                    | 1257     |
|    iterations             | 39       |
|    time_elapsed           | 63       |
|    total_timesteps        | 79872    |
| train/                    |          |
|    explained_variance     | -3.3     |
|    is_line_search_success | 1        |
|    kl_divergence_loss     | 0.00598  |
|    learning_rate          | 0.0003   |
|    n_updates              | 38       |
|    policy_objective       | 0.00501  |
|    value_loss             | 0.00118  |
----------------------------------------
----------------------------------------
| rollout/                  |          |
|    ep_len_mean            | 493      |
|    ep_rew_mean            | 493      |
| time/                     |          |
|    fps                    | 1258     |
|    iterations             | 40       |
|    time_elapsed           | 65       |
|    total_timesteps        | 81920    |
| train/                    |          |
|    explained_variance     | -0.969   |
|    is_line_search_success | 1        |
|    kl_divergence_loss     | 0.00663  |
|    learning_rate          | 0.0003   |
|    n_updates              | 39       |
|    policy_objective       | 0.00342  |
|    value_loss             | 0.0009   |
----------------------------------------
----------------------------------------
| rollout/                  |          |
|    ep_len_mean            | 494      |
|    ep_rew_mean            | 494      |
| time/                     |          |
|    fps                    | 1260     |
|    iterations             | 41       |
|    time_elapsed           | 66       |
|    total_timesteps        | 83968    |
| train/                    |          |
|    explained_variance     | -0.431   |
|    is_line_search_success | 1        |
|    kl_divergence_loss     | 0.0068   |
|    learning_rate          | 0.0003   |
|    n_updates              | 40       |
|    policy_objective       | 0.00431  |
|    value_loss             | 0.000875 |
----------------------------------------
----------------------------------------
| rollout/                  |          |
|    ep_len_mean            | 494      |
|    ep_rew_mean            | 494      |
| time/                     |          |
|    fps                    | 1261     |
|    iterations             | 42       |
|    time_elapsed           | 68       |
|    total_timesteps        | 86016    |
| train/                    |          |
|    explained_variance     | -1.71    |
|    is_line_search_success | 1        |
|    kl_divergence_loss     | 0.0092   |
|    learning_rate          | 0.0003   |
|    n_updates              | 41       |
|    policy_objective       | 0.00747  |
|    value_loss             | 0.000746 |
----------------------------------------
----------------------------------------
| rollout/                  |          |
|    ep_len_mean            | 494      |
|    ep_rew_mean            | 494      |
| time/                     |          |
|    fps                    | 1263     |
|    iterations             | 43       |
|    time_elapsed           | 69       |
|    total_timesteps        | 88064    |
| train/                    |          |
|    explained_variance     | -3.23    |
|    is_line_search_success | 1        |
|    kl_divergence_loss     | 0.00929  |
|    learning_rate          | 0.0003   |
|    n_updates              | 42       |
|    policy_objective       | 0.00871  |
|    value_loss             | 0.000974 |
----------------------------------------
----------------------------------------
| rollout/                  |          |
|    ep_len_mean            | 494      |
|    ep_rew_mean            | 494      |
| time/                     |          |
|    fps                    | 1265     |
|    iterations             | 44       |
|    time_elapsed           | 71       |
|    total_timesteps        | 90112    |
| train/                    |          |
|    explained_variance     | -1.13    |
|    is_line_search_success | 1        |
|    kl_divergence_loss     | 0.00641  |
|    learning_rate          | 0.0003   |
|    n_updates              | 43       |
|    policy_objective       | 0.00511  |
|    value_loss             | 0.000516 |
----------------------------------------
----------------------------------------
| rollout/                  |          |
|    ep_len_mean            | 494      |
|    ep_rew_mean            | 494      |
| time/                     |          |
|    fps                    | 1265     |
|    iterations             | 45       |
|    time_elapsed           | 72       |
|    total_timesteps        | 92160    |
| train/                    |          |
|    explained_variance     | -2.83    |
|    is_line_search_success | 1        |
|    kl_divergence_loss     | 0.00711  |
|    learning_rate          | 0.0003   |
|    n_updates              | 44       |
|    policy_objective       | 0.0173   |
|    value_loss             | 0.000744 |
----------------------------------------
----------------------------------------
| rollout/                  |          |
|    ep_len_mean            | 494      |
|    ep_rew_mean            | 494      |
| time/                     |          |
|    fps                    | 1266     |
|    iterations             | 46       |
|    time_elapsed           | 74       |
|    total_timesteps        | 94208    |
| train/                    |          |
|    explained_variance     | -1.51    |
|    is_line_search_success | 1        |
|    kl_divergence_loss     | 0.00716  |
|    learning_rate          | 0.0003   |
|    n_updates              | 45       |
|    policy_objective       | 0.0133   |
|    value_loss             | 0.000726 |
----------------------------------------
----------------------------------------
| rollout/                  |          |
|    ep_len_mean            | 494      |
|    ep_rew_mean            | 494      |
| time/                     |          |
|    fps                    | 1267     |
|    iterations             | 47       |
|    time_elapsed           | 75       |
|    total_timesteps        | 96256    |
| train/                    |          |
|    explained_variance     | -1.52    |
|    is_line_search_success | 1        |
|    kl_divergence_loss     | 0.00762  |
|    learning_rate          | 0.0003   |
|    n_updates              | 46       |
|    policy_objective       | 0.00701  |
|    value_loss             | 0.000726 |
----------------------------------------
----------------------------------------
| rollout/                  |          |
|    ep_len_mean            | 494      |
|    ep_rew_mean            | 494      |
| time/                     |          |
|    fps                    | 1269     |
|    iterations             | 48       |
|    time_elapsed           | 77       |
|    total_timesteps        | 98304    |
| train/                    |          |
|    explained_variance     | -0.566   |
|    is_line_search_success | 1        |
|    kl_divergence_loss     | 0.00529  |
|    learning_rate          | 0.0003   |
|    n_updates              | 47       |
|    policy_objective       | 0.00362  |
|    value_loss             | 0.000462 |
----------------------------------------
----------------------------------------
| rollout/                  |          |
|    ep_len_mean            | 496      |
|    ep_rew_mean            | 496      |
| time/                     |          |
|    fps                    | 1269     |
|    iterations             | 49       |
|    time_elapsed           | 79       |
|    total_timesteps        | 100352   |
| train/                    |          |
|    explained_variance     | -1.48    |
|    is_line_search_success | 1        |
|    kl_divergence_loss     | 0.00899  |
|    learning_rate          | 0.0003   |
|    n_updates              | 48       |
|    policy_objective       | 0.00568  |
|    value_loss             | 0.000603 |
----------------------------------------
wandb: WARNING Symlinked 1 file into the W&B run directory; call wandb.save again to sync new files.
wandb: updating run metadata
wandb: updating run metadata; uploading model.zip; uploading output.log; uploading wandb-summary.json
wandb: uploading model.zip; uploading output.log
wandb: uploading config.yaml; uploading logs/CartPole_gravity_jump_Baseline_20251217_125255_0/events.out.tfevents.1765950780.hungchan-Precision-7560.37149.0
wandb: uploading history steps 381-434, summary, console lines 810-882
wandb: 
wandb: Run history:
wandb:                  global_step ▁▁▁▁▁▂▂▂▂▂▃▃▃▃▃▄▄▄▄▄▄▄▅▅▅▅▅▅▆▆▆▇▇▇▇▇▇▇██
wandb:          rollout/ep_len_mean ▁▁▁▁▂▂▂▂▃▃▃▄▄▄▅▅▅▆▆▆▆▇▇▇▇▇██████████████
wandb:          rollout/ep_rew_mean ▁▁▁▁▂▂▂▂▃▃▃▄▄▄▅▅▅▆▆▆▆▇▇▇▇▇██████████████
wandb:                     time/fps █▅▅▅▆▆▆▆▆▆▆▆▆▆▆▅▅▅▄▃▂▂▁▁▁▁▁▁▁▁▁▁▁▂▂▂▂▂▂▂
wandb:     train/explained_variance ▆▇▇▇▇▇██████▇▆█▆▆▆▆▇▆▂▅▇▅▂▃▁▂▂▅▁▅▆▄▅▂▄▄▄
wandb: train/is_line_search_success ▁▁▁▁▁▁▁▁▁▁▁▁▁▁▁▁▁▁▁▁▁▁▁▁▁▁▁▁▁▁▁▁▁▁▁▁▁▁▁▁
wandb:     train/kl_divergence_loss ▇▇▆▆▅▆▆▆▄▆█▆▇▆█▆▄▆█▄▅▄▄▅▆▁▄▄▅▆▃▄▅▅█▄▅▅▆▇
wandb:          train/learning_rate ▁▁▁▁▁▁▁▁▁▁▁▁▁▁▁▁▁▁▁▁▁▁▁▁▁▁▁▁▁▁▁▁▁▁▁▁▁▁▁▁
wandb:       train/policy_objective ▅▆▇▇█▅▅▄▅▂▆▆▂▂▆▂▂▁▂▂▄▂▃▃▅▁▂▁▂▂▁▂▁▂▂▂▅▄▂▂
wandb:             train/value_loss ▅▄▅▆█▄▃▄▃▂▁▃▁▁▂▁▁▁▁▁█▁▁▁▁▁▁▁▁▁▁▁▁▁▁▁▁▁▁▁
wandb: 
wandb: Run summary:
wandb:                  global_step 100352
wandb:          rollout/ep_len_mean 496.47
wandb:          rollout/ep_rew_mean 496.47
wandb:                     time/fps 1269
wandb:     train/explained_variance -1.4817
wandb: train/is_line_search_success 1
wandb:     train/kl_divergence_loss 0.00899
wandb:          train/learning_rate 0.0003
wandb:       train/policy_objective 0.00568
wandb:             train/value_loss 0.0006
wandb: 
wandb: 🚀 View run CartPole_gravity_jump_Baseline_20251217_125255 at: https://wandb.ai/hungtrab-hanoi-university-of-science-and-technology/CartPole_Drift_Research_TRPO/runs/d0mu5meg
wandb: ⭐️ View project at: https://wandb.ai/hungtrab-hanoi-university-of-science-and-technology/CartPole_Drift_Research_TRPO
wandb: Synced 6 W&B file(s), 0 media file(s), 0 artifact file(s) and 2 other file(s)
wandb: Find logs at: logs/CartPole_gravity_jump_Baseline_20251217_125255/wandb/run-20251217_125258-d0mu5meg/logs
Model saved locally to: models/CartPole_gravity_jump_Baseline_20251217_125255.zip
