wandb: Currently logged in as: hungtrab (hungtrab-hanoi-university-of-science-and-technology) to https://api.wandb.ai. Use `wandb login --relogin` to force relogin
wandb: setting up run r8393xfb
wandb: Tracking run with wandb version 0.23.1
wandb: Run data is saved locally in logs/CartPole_gravity_sine_Baseline_20251217_125255/wandb/run-20251217_125601-r8393xfb
wandb: Run `wandb offline` to turn off syncing.
wandb: Syncing run CartPole_gravity_sine_Baseline_20251217_125255
wandb: ⭐️ View project at https://wandb.ai/hungtrab-hanoi-university-of-science-and-technology/CartPole_Drift_Research_TRPO
wandb: 🚀 View run at https://wandb.ai/hungtrab-hanoi-university-of-science-and-technology/CartPole_Drift_Research_TRPO/runs/r8393xfb
/home/hungchan/miniconda3/envs/rl_hf_course/lib/python3.10/site-packages/stable_baselines3/common/on_policy_algorithm.py:150: UserWarning: You are trying to run TRPO on the GPU, but it is primarily intended to run on the CPU when not using a CNN policy (you are using ActorCriticPolicy which should be a MlpPolicy). See https://github.com/DLR-RM/stable-baselines3/issues/1245 for more info. You can pass `device='cpu'` or `export CUDA_VISIBLE_DEVICES=` to force using the CPU.Note: The model will train, but the GPU utilization will be poor and the training might take longer than on CPU.
  warnings.warn(
--- Training Start: CartPole_gravity_sine_Baseline_20251217_125255 ---
>>> [Wrapper] Initialized Non-Stationary CartPole
    - gravity: sine (magnitude=5.0, period=20000)
>>> Initializing TRPO with kwargs: ['policy', 'env', 'learning_rate', 'gamma', 'verbose', 'tensorboard_log', 'n_steps', 'batch_size']
Using cuda device
Wrapping the env in a DummyVecEnv.
Logging to logs/CartPole_gravity_sine_Baseline_20251217_125255_0
---------------------------------
| rollout/           |          |
|    ep_len_mean     | 24       |
|    ep_rew_mean     | 24       |
| time/              |          |
|    fps             | 1285     |
|    iterations      | 1        |
|    time_elapsed    | 1        |
|    total_timesteps | 2048     |
---------------------------------
----------------------------------------
| rollout/                  |          |
|    ep_len_mean            | 25.7     |
|    ep_rew_mean            | 25.7     |
| time/                     |          |
|    fps                    | 1263     |
|    iterations             | 2        |
|    time_elapsed           | 3        |
|    total_timesteps        | 4096     |
| train/                    |          |
|    explained_variance     | -0.0209  |
|    is_line_search_success | 1        |
|    kl_divergence_loss     | 0.00775  |
|    learning_rate          | 0.0003   |
|    n_updates              | 1        |
|    policy_objective       | 0.0171   |
|    value_loss             | 54.3     |
----------------------------------------
----------------------------------------
| rollout/                  |          |
|    ep_len_mean            | 31.5     |
|    ep_rew_mean            | 31.5     |
| time/                     |          |
|    fps                    | 1283     |
|    iterations             | 3        |
|    time_elapsed           | 4        |
|    total_timesteps        | 6144     |
| train/                    |          |
|    explained_variance     | 0.0614   |
|    is_line_search_success | 1        |
|    kl_divergence_loss     | 0.00836  |
|    learning_rate          | 0.0003   |
|    n_updates              | 2        |
|    policy_objective       | 0.0263   |
|    value_loss             | 39.1     |
----------------------------------------
----------------------------------------
| rollout/                  |          |
|    ep_len_mean            | 40       |
|    ep_rew_mean            | 40       |
| time/                     |          |
|    fps                    | 1285     |
|    iterations             | 4        |
|    time_elapsed           | 6        |
|    total_timesteps        | 8192     |
| train/                    |          |
|    explained_variance     | 0.171    |
|    is_line_search_success | 1        |
|    kl_divergence_loss     | 0.00793  |
|    learning_rate          | 0.0003   |
|    n_updates              | 3        |
|    policy_objective       | 0.0259   |
|    value_loss             | 48.3     |
----------------------------------------
----------------------------------------
| rollout/                  |          |
|    ep_len_mean            | 51.9     |
|    ep_rew_mean            | 51.9     |
| time/                     |          |
|    fps                    | 1281     |
|    iterations             | 5        |
|    time_elapsed           | 7        |
|    total_timesteps        | 10240    |
| train/                    |          |
|    explained_variance     | 0.258    |
|    is_line_search_success | 1        |
|    kl_divergence_loss     | 0.00759  |
|    learning_rate          | 0.0003   |
|    n_updates              | 4        |
|    policy_objective       | 0.0259   |
|    value_loss             | 56.9     |
----------------------------------------
----------------------------------------
| rollout/                  |          |
|    ep_len_mean            | 67.3     |
|    ep_rew_mean            | 67.3     |
| time/                     |          |
|    fps                    | 1289     |
|    iterations             | 6        |
|    time_elapsed           | 9        |
|    total_timesteps        | 12288    |
| train/                    |          |
|    explained_variance     | 0.255    |
|    is_line_search_success | 1        |
|    kl_divergence_loss     | 0.00693  |
|    learning_rate          | 0.0003   |
|    n_updates              | 5        |
|    policy_objective       | 0.0234   |
|    value_loss             | 65.1     |
----------------------------------------
----------------------------------------
| rollout/                  |          |
|    ep_len_mean            | 81.8     |
|    ep_rew_mean            | 81.8     |
| time/                     |          |
|    fps                    | 1294     |
|    iterations             | 7        |
|    time_elapsed           | 11       |
|    total_timesteps        | 14336    |
| train/                    |          |
|    explained_variance     | 0.343    |
|    is_line_search_success | 1        |
|    kl_divergence_loss     | 0.00722  |
|    learning_rate          | 0.0003   |
|    n_updates              | 6        |
|    policy_objective       | 0.0249   |
|    value_loss             | 65.1     |
----------------------------------------
----------------------------------------
| rollout/                  |          |
|    ep_len_mean            | 103      |
|    ep_rew_mean            | 103      |
| time/                     |          |
|    fps                    | 1295     |
|    iterations             | 8        |
|    time_elapsed           | 12       |
|    total_timesteps        | 16384    |
| train/                    |          |
|    explained_variance     | 0.601    |
|    is_line_search_success | 1        |
|    kl_divergence_loss     | 0.00728  |
|    learning_rate          | 0.0003   |
|    n_updates              | 7        |
|    policy_objective       | 0.0143   |
|    value_loss             | 37.3     |
----------------------------------------
----------------------------------------
| rollout/                  |          |
|    ep_len_mean            | 120      |
|    ep_rew_mean            | 120      |
| time/                     |          |
|    fps                    | 1296     |
|    iterations             | 9        |
|    time_elapsed           | 14       |
|    total_timesteps        | 18432    |
| train/                    |          |
|    explained_variance     | 0.746    |
|    is_line_search_success | 1        |
|    kl_divergence_loss     | 0.0076   |
|    learning_rate          | 0.0003   |
|    n_updates              | 8        |
|    policy_objective       | 0.0128   |
|    value_loss             | 27.8     |
----------------------------------------
----------------------------------------
| rollout/                  |          |
|    ep_len_mean            | 137      |
|    ep_rew_mean            | 137      |
| time/                     |          |
|    fps                    | 1296     |
|    iterations             | 10       |
|    time_elapsed           | 15       |
|    total_timesteps        | 20480    |
| train/                    |          |
|    explained_variance     | 0.86     |
|    is_line_search_success | 1        |
|    kl_divergence_loss     | 0.0087   |
|    learning_rate          | 0.0003   |
|    n_updates              | 9        |
|    policy_objective       | 0.0228   |
|    value_loss             | 22       |
----------------------------------------
----------------------------------------
| rollout/                  |          |
|    ep_len_mean            | 155      |
|    ep_rew_mean            | 155      |
| time/                     |          |
|    fps                    | 1295     |
|    iterations             | 11       |
|    time_elapsed           | 17       |
|    total_timesteps        | 22528    |
| train/                    |          |
|    explained_variance     | 0.789    |
|    is_line_search_success | 1        |
|    kl_divergence_loss     | 0.00616  |
|    learning_rate          | 0.0003   |
|    n_updates              | 10       |
|    policy_objective       | 0.00888  |
|    value_loss             | 27.4     |
----------------------------------------
----------------------------------------
| rollout/                  |          |
|    ep_len_mean            | 172      |
|    ep_rew_mean            | 172      |
| time/                     |          |
|    fps                    | 1294     |
|    iterations             | 12       |
|    time_elapsed           | 18       |
|    total_timesteps        | 24576    |
| train/                    |          |
|    explained_variance     | 0.348    |
|    is_line_search_success | 1        |
|    kl_divergence_loss     | 0.0094   |
|    learning_rate          | 0.0003   |
|    n_updates              | 11       |
|    policy_objective       | 0.0104   |
|    value_loss             | 8.06     |
----------------------------------------
----------------------------------------
| rollout/                  |          |
|    ep_len_mean            | 191      |
|    ep_rew_mean            | 191      |
| time/                     |          |
|    fps                    | 1290     |
|    iterations             | 13       |
|    time_elapsed           | 20       |
|    total_timesteps        | 26624    |
| train/                    |          |
|    explained_variance     | 0.0248   |
|    is_line_search_success | 1        |
|    kl_divergence_loss     | 0.00496  |
|    learning_rate          | 0.0003   |
|    n_updates              | 12       |
|    policy_objective       | 0.00542  |
|    value_loss             | 66.8     |
----------------------------------------
----------------------------------------
| rollout/                  |          |
|    ep_len_mean            | 209      |
|    ep_rew_mean            | 209      |
| time/                     |          |
|    fps                    | 1291     |
|    iterations             | 14       |
|    time_elapsed           | 22       |
|    total_timesteps        | 28672    |
| train/                    |          |
|    explained_variance     | 0.15     |
|    is_line_search_success | 1        |
|    kl_divergence_loss     | 0.00733  |
|    learning_rate          | 0.0003   |
|    n_updates              | 13       |
|    policy_objective       | 0.0117   |
|    value_loss             | 28.2     |
----------------------------------------
----------------------------------------
| rollout/                  |          |
|    ep_len_mean            | 227      |
|    ep_rew_mean            | 227      |
| time/                     |          |
|    fps                    | 1290     |
|    iterations             | 15       |
|    time_elapsed           | 23       |
|    total_timesteps        | 30720    |
| train/                    |          |
|    explained_variance     | 0.728    |
|    is_line_search_success | 1        |
|    kl_divergence_loss     | 0.00998  |
|    learning_rate          | 0.0003   |
|    n_updates              | 14       |
|    policy_objective       | 0.0176   |
|    value_loss             | 8.71     |
----------------------------------------
----------------------------------------
| rollout/                  |          |
|    ep_len_mean            | 246      |
|    ep_rew_mean            | 246      |
| time/                     |          |
|    fps                    | 1284     |
|    iterations             | 16       |
|    time_elapsed           | 25       |
|    total_timesteps        | 32768    |
| train/                    |          |
|    explained_variance     | 0.0678   |
|    is_line_search_success | 1        |
|    kl_divergence_loss     | 0.00847  |
|    learning_rate          | 0.0003   |
|    n_updates              | 15       |
|    policy_objective       | 0.0093   |
|    value_loss             | 2.25     |
----------------------------------------
----------------------------------------
| rollout/                  |          |
|    ep_len_mean            | 264      |
|    ep_rew_mean            | 264      |
| time/                     |          |
|    fps                    | 1286     |
|    iterations             | 17       |
|    time_elapsed           | 27       |
|    total_timesteps        | 34816    |
| train/                    |          |
|    explained_variance     | -0.0316  |
|    is_line_search_success | 1        |
|    kl_divergence_loss     | 0.00868  |
|    learning_rate          | 0.0003   |
|    n_updates              | 16       |
|    policy_objective       | 0.00434  |
|    value_loss             | 1.5      |
----------------------------------------
----------------------------------------
| rollout/                  |          |
|    ep_len_mean            | 282      |
|    ep_rew_mean            | 282      |
| time/                     |          |
|    fps                    | 1290     |
|    iterations             | 18       |
|    time_elapsed           | 28       |
|    total_timesteps        | 36864    |
| train/                    |          |
|    explained_variance     | -0.0613  |
|    is_line_search_success | 1        |
|    kl_divergence_loss     | 0.00632  |
|    learning_rate          | 0.0003   |
|    n_updates              | 17       |
|    policy_objective       | 0.003    |
|    value_loss             | 0.984    |
----------------------------------------
----------------------------------------
| rollout/                  |          |
|    ep_len_mean            | 302      |
|    ep_rew_mean            | 302      |
| time/                     |          |
|    fps                    | 1291     |
|    iterations             | 19       |
|    time_elapsed           | 30       |
|    total_timesteps        | 38912    |
| train/                    |          |
|    explained_variance     | -0.0676  |
|    is_line_search_success | 1        |
|    kl_divergence_loss     | 0.00886  |
|    learning_rate          | 0.0003   |
|    n_updates              | 18       |
|    policy_objective       | 0.00557  |
|    value_loss             | 0.634    |
----------------------------------------
----------------------------------------
| rollout/                  |          |
|    ep_len_mean            | 318      |
|    ep_rew_mean            | 318      |
| time/                     |          |
|    fps                    | 1295     |
|    iterations             | 20       |
|    time_elapsed           | 31       |
|    total_timesteps        | 40960    |
| train/                    |          |
|    explained_variance     | -0.00966 |
|    is_line_search_success | 1        |
|    kl_divergence_loss     | 0.00736  |
|    learning_rate          | 0.0003   |
|    n_updates              | 19       |
|    policy_objective       | 0.0086   |
|    value_loss             | 0.411    |
----------------------------------------
----------------------------------------
| rollout/                  |          |
|    ep_len_mean            | 333      |
|    ep_rew_mean            | 333      |
| time/                     |          |
|    fps                    | 1297     |
|    iterations             | 21       |
|    time_elapsed           | 33       |
|    total_timesteps        | 43008    |
| train/                    |          |
|    explained_variance     | 0.0101   |
|    is_line_search_success | 1        |
|    kl_divergence_loss     | 0.00741  |
|    learning_rate          | 0.0003   |
|    n_updates              | 20       |
|    policy_objective       | 0.00444  |
|    value_loss             | 0.259    |
----------------------------------------
----------------------------------------
| rollout/                  |          |
|    ep_len_mean            | 350      |
|    ep_rew_mean            | 350      |
| time/                     |          |
|    fps                    | 1295     |
|    iterations             | 22       |
|    time_elapsed           | 34       |
|    total_timesteps        | 45056    |
| train/                    |          |
|    explained_variance     | 0.00518  |
|    is_line_search_success | 1        |
|    kl_divergence_loss     | 0.00711  |
|    learning_rate          | 0.0003   |
|    n_updates              | 21       |
|    policy_objective       | 0.0139   |
|    value_loss             | 63.6     |
----------------------------------------
----------------------------------------
| rollout/                  |          |
|    ep_len_mean            | 369      |
|    ep_rew_mean            | 369      |
| time/                     |          |
|    fps                    | 1294     |
|    iterations             | 23       |
|    time_elapsed           | 36       |
|    total_timesteps        | 47104    |
| train/                    |          |
|    explained_variance     | 0.234    |
|    is_line_search_success | 1        |
|    kl_divergence_loss     | 0.00651  |
|    learning_rate          | 0.0003   |
|    n_updates              | 22       |
|    policy_objective       | 0.00913  |
|    value_loss             | 1.73     |
----------------------------------------
----------------------------------------
| rollout/                  |          |
|    ep_len_mean            | 385      |
|    ep_rew_mean            | 385      |
| time/                     |          |
|    fps                    | 1294     |
|    iterations             | 24       |
|    time_elapsed           | 37       |
|    total_timesteps        | 49152    |
| train/                    |          |
|    explained_variance     | 0.604    |
|    is_line_search_success | 1        |
|    kl_divergence_loss     | 0.00763  |
|    learning_rate          | 0.0003   |
|    n_updates              | 23       |
|    policy_objective       | 0.0152   |
|    value_loss             | 0.413    |
----------------------------------------
----------------------------------------
| rollout/                  |          |
|    ep_len_mean            | 401      |
|    ep_rew_mean            | 401      |
| time/                     |          |
|    fps                    | 1292     |
|    iterations             | 25       |
|    time_elapsed           | 39       |
|    total_timesteps        | 51200    |
| train/                    |          |
|    explained_variance     | -1.33    |
|    is_line_search_success | 1        |
|    kl_divergence_loss     | 0.00607  |
|    learning_rate          | 0.0003   |
|    n_updates              | 24       |
|    policy_objective       | 0.00552  |
|    value_loss             | 0.0954   |
----------------------------------------
----------------------------------------
| rollout/                  |          |
|    ep_len_mean            | 414      |
|    ep_rew_mean            | 414      |
| time/                     |          |
|    fps                    | 1294     |
|    iterations             | 26       |
|    time_elapsed           | 41       |
|    total_timesteps        | 53248    |
| train/                    |          |
|    explained_variance     | 0.347    |
|    is_line_search_success | 1        |
|    kl_divergence_loss     | 0.00735  |
|    learning_rate          | 0.0003   |
|    n_updates              | 25       |
|    policy_objective       | 0.00921  |
|    value_loss             | 0.0588   |
----------------------------------------
----------------------------------------
| rollout/                  |          |
|    ep_len_mean            | 429      |
|    ep_rew_mean            | 429      |
| time/                     |          |
|    fps                    | 1295     |
|    iterations             | 27       |
|    time_elapsed           | 42       |
|    total_timesteps        | 55296    |
| train/                    |          |
|    explained_variance     | -1.15    |
|    is_line_search_success | 1        |
|    kl_divergence_loss     | 0.00608  |
|    learning_rate          | 0.0003   |
|    n_updates              | 26       |
|    policy_objective       | 0.00323  |
|    value_loss             | 0.0325   |
----------------------------------------
----------------------------------------
| rollout/                  |          |
|    ep_len_mean            | 442      |
|    ep_rew_mean            | 442      |
| time/                     |          |
|    fps                    | 1294     |
|    iterations             | 28       |
|    time_elapsed           | 44       |
|    total_timesteps        | 57344    |
| train/                    |          |
|    explained_variance     | -0.754   |
|    is_line_search_success | 1        |
|    kl_divergence_loss     | 0.00652  |
|    learning_rate          | 0.0003   |
|    n_updates              | 27       |
|    policy_objective       | 0.00311  |
|    value_loss             | 0.0189   |
----------------------------------------
----------------------------------------
| rollout/                  |          |
|    ep_len_mean            | 454      |
|    ep_rew_mean            | 454      |
| time/                     |          |
|    fps                    | 1293     |
|    iterations             | 29       |
|    time_elapsed           | 45       |
|    total_timesteps        | 59392    |
| train/                    |          |
|    explained_variance     | 0.557    |
|    is_line_search_success | 1        |
|    kl_divergence_loss     | 0.00876  |
|    learning_rate          | 0.0003   |
|    n_updates              | 28       |
|    policy_objective       | 0.00674  |
|    value_loss             | 0.0126   |
----------------------------------------
----------------------------------------
| rollout/                  |          |
|    ep_len_mean            | 462      |
|    ep_rew_mean            | 462      |
| time/                     |          |
|    fps                    | 1295     |
|    iterations             | 30       |
|    time_elapsed           | 47       |
|    total_timesteps        | 61440    |
| train/                    |          |
|    explained_variance     | -0.849   |
|    is_line_search_success | 1        |
|    kl_divergence_loss     | 0.00512  |
|    learning_rate          | 0.0003   |
|    n_updates              | 29       |
|    policy_objective       | 0.00664  |
|    value_loss             | 0.00866  |
----------------------------------------
----------------------------------------
| rollout/                  |          |
|    ep_len_mean            | 469      |
|    ep_rew_mean            | 469      |
| time/                     |          |
|    fps                    | 1294     |
|    iterations             | 31       |
|    time_elapsed           | 49       |
|    total_timesteps        | 63488    |
| train/                    |          |
|    explained_variance     | -0.648   |
|    is_line_search_success | 1        |
|    kl_divergence_loss     | 0.00954  |
|    learning_rate          | 0.0003   |
|    n_updates              | 30       |
|    policy_objective       | 0.00579  |
|    value_loss             | 0.00593  |
----------------------------------------
----------------------------------------
| rollout/                  |          |
|    ep_len_mean            | 474      |
|    ep_rew_mean            | 474      |
| time/                     |          |
|    fps                    | 1296     |
|    iterations             | 32       |
|    time_elapsed           | 50       |
|    total_timesteps        | 65536    |
| train/                    |          |
|    explained_variance     | -0.118   |
|    is_line_search_success | 1        |
|    kl_divergence_loss     | 0.00492  |
|    learning_rate          | 0.0003   |
|    n_updates              | 31       |
|    policy_objective       | 0.00509  |
|    value_loss             | 0.0036   |
----------------------------------------
----------------------------------------
| rollout/                  |          |
|    ep_len_mean            | 483      |
|    ep_rew_mean            | 483      |
| time/                     |          |
|    fps                    | 1296     |
|    iterations             | 33       |
|    time_elapsed           | 52       |
|    total_timesteps        | 67584    |
| train/                    |          |
|    explained_variance     | -0.458   |
|    is_line_search_success | 1        |
|    kl_divergence_loss     | 0.00584  |
|    learning_rate          | 0.0003   |
|    n_updates              | 32       |
|    policy_objective       | 0.00607  |
|    value_loss             | 0.00307  |
----------------------------------------
----------------------------------------
| rollout/                  |          |
|    ep_len_mean            | 484      |
|    ep_rew_mean            | 484      |
| time/                     |          |
|    fps                    | 1298     |
|    iterations             | 34       |
|    time_elapsed           | 53       |
|    total_timesteps        | 69632    |
| train/                    |          |
|    explained_variance     | -1.29    |
|    is_line_search_success | 1        |
|    kl_divergence_loss     | 0.00775  |
|    learning_rate          | 0.0003   |
|    n_updates              | 33       |
|    policy_objective       | 0.00767  |
|    value_loss             | 0.00223  |
----------------------------------------
----------------------------------------
| rollout/                  |          |
|    ep_len_mean            | 486      |
|    ep_rew_mean            | 486      |
| time/                     |          |
|    fps                    | 1300     |
|    iterations             | 35       |
|    time_elapsed           | 55       |
|    total_timesteps        | 71680    |
| train/                    |          |
|    explained_variance     | -1.73    |
|    is_line_search_success | 1        |
|    kl_divergence_loss     | 0.00509  |
|    learning_rate          | 0.0003   |
|    n_updates              | 34       |
|    policy_objective       | 0.00731  |
|    value_loss             | 0.00143  |
----------------------------------------
----------------------------------------
| rollout/                  |          |
|    ep_len_mean            | 493      |
|    ep_rew_mean            | 493      |
| time/                     |          |
|    fps                    | 1300     |
|    iterations             | 36       |
|    time_elapsed           | 56       |
|    total_timesteps        | 73728    |
| train/                    |          |
|    explained_variance     | -3.29    |
|    is_line_search_success | 1        |
|    kl_divergence_loss     | 0.00302  |
|    learning_rate          | 0.0003   |
|    n_updates              | 35       |
|    policy_objective       | 0.000602 |
|    value_loss             | 0.00114  |
----------------------------------------
----------------------------------------
| rollout/                  |          |
|    ep_len_mean            | 497      |
|    ep_rew_mean            | 497      |
| time/                     |          |
|    fps                    | 1301     |
|    iterations             | 37       |
|    time_elapsed           | 58       |
|    total_timesteps        | 75776    |
| train/                    |          |
|    explained_variance     | -1.87    |
|    is_line_search_success | 1        |
|    kl_divergence_loss     | 0.00723  |
|    learning_rate          | 0.0003   |
|    n_updates              | 36       |
|    policy_objective       | 0.00652  |
|    value_loss             | 0.000871 |
----------------------------------------
----------------------------------------
| rollout/                  |          |
|    ep_len_mean            | 497      |
|    ep_rew_mean            | 497      |
| time/                     |          |
|    fps                    | 1302     |
|    iterations             | 38       |
|    time_elapsed           | 59       |
|    total_timesteps        | 77824    |
| train/                    |          |
|    explained_variance     | 0.906    |
|    is_line_search_success | 1        |
|    kl_divergence_loss     | 0.00824  |
|    learning_rate          | 0.0003   |
|    n_updates              | 37       |
|    policy_objective       | 0.00956  |
|    value_loss             | 0.000884 |
----------------------------------------
----------------------------------------
| rollout/                  |          |
|    ep_len_mean            | 497      |
|    ep_rew_mean            | 497      |
| time/                     |          |
|    fps                    | 1302     |
|    iterations             | 39       |
|    time_elapsed           | 61       |
|    total_timesteps        | 79872    |
| train/                    |          |
|    explained_variance     | -0.225   |
|    is_line_search_success | 1        |
|    kl_divergence_loss     | 0.00765  |
|    learning_rate          | 0.0003   |
|    n_updates              | 38       |
|    policy_objective       | 0.00917  |
|    value_loss             | 0.000484 |
----------------------------------------
----------------------------------------
| rollout/                  |          |
|    ep_len_mean            | 497      |
|    ep_rew_mean            | 497      |
| time/                     |          |
|    fps                    | 1300     |
|    iterations             | 40       |
|    time_elapsed           | 62       |
|    total_timesteps        | 81920    |
| train/                    |          |
|    explained_variance     | -3.04    |
|    is_line_search_success | 1        |
|    kl_divergence_loss     | 0.00887  |
|    learning_rate          | 0.0003   |
|    n_updates              | 39       |
|    policy_objective       | 0.00539  |
|    value_loss             | 0.000374 |
----------------------------------------
----------------------------------------
| rollout/                  |          |
|    ep_len_mean            | 497      |
|    ep_rew_mean            | 497      |
| time/                     |          |
|    fps                    | 1301     |
|    iterations             | 41       |
|    time_elapsed           | 64       |
|    total_timesteps        | 83968    |
| train/                    |          |
|    explained_variance     | 0.848    |
|    is_line_search_success | 1        |
|    kl_divergence_loss     | 0.00861  |
|    learning_rate          | 0.0003   |
|    n_updates              | 40       |
|    policy_objective       | 0.00822  |
|    value_loss             | 0.000412 |
----------------------------------------
----------------------------------------
| rollout/                  |          |
|    ep_len_mean            | 497      |
|    ep_rew_mean            | 497      |
| time/                     |          |
|    fps                    | 1299     |
|    iterations             | 42       |
|    time_elapsed           | 66       |
|    total_timesteps        | 86016    |
| train/                    |          |
|    explained_variance     | 0.666    |
|    is_line_search_success | 1        |
|    kl_divergence_loss     | 0.00584  |
|    learning_rate          | 0.0003   |
|    n_updates              | 41       |
|    policy_objective       | 0.00512  |
|    value_loss             | 0.000271 |
----------------------------------------
----------------------------------------
| rollout/                  |          |
|    ep_len_mean            | 497      |
|    ep_rew_mean            | 497      |
| time/                     |          |
|    fps                    | 1299     |
|    iterations             | 43       |
|    time_elapsed           | 67       |
|    total_timesteps        | 88064    |
| train/                    |          |
|    explained_variance     | -1.13    |
|    is_line_search_success | 1        |
|    kl_divergence_loss     | 0.00653  |
|    learning_rate          | 0.0003   |
|    n_updates              | 42       |
|    policy_objective       | 0.00442  |
|    value_loss             | 0.000238 |
----------------------------------------
----------------------------------------
| rollout/                  |          |
|    ep_len_mean            | 497      |
|    ep_rew_mean            | 497      |
| time/                     |          |
|    fps                    | 1301     |
|    iterations             | 44       |
|    time_elapsed           | 69       |
|    total_timesteps        | 90112    |
| train/                    |          |
|    explained_variance     | -3.8     |
|    is_line_search_success | 1        |
|    kl_divergence_loss     | 0.00948  |
|    learning_rate          | 0.0003   |
|    n_updates              | 43       |
|    policy_objective       | 0.0101   |
|    value_loss             | 0.000244 |
----------------------------------------
----------------------------------------
| rollout/                  |          |
|    ep_len_mean            | 497      |
|    ep_rew_mean            | 497      |
| time/                     |          |
|    fps                    | 1301     |
|    iterations             | 45       |
|    time_elapsed           | 70       |
|    total_timesteps        | 92160    |
| train/                    |          |
|    explained_variance     | -0.72    |
|    is_line_search_success | 1        |
|    kl_divergence_loss     | 0.00645  |
|    learning_rate          | 0.0003   |
|    n_updates              | 44       |
|    policy_objective       | 0.00433  |
|    value_loss             | 0.000181 |
----------------------------------------
----------------------------------------
| rollout/                  |          |
|    ep_len_mean            | 500      |
|    ep_rew_mean            | 500      |
| time/                     |          |
|    fps                    | 1302     |
|    iterations             | 46       |
|    time_elapsed           | 72       |
|    total_timesteps        | 94208    |
| train/                    |          |
|    explained_variance     | -0.705   |
|    is_line_search_success | 1        |
|    kl_divergence_loss     | 0.00775  |
|    learning_rate          | 0.0003   |
|    n_updates              | 45       |
|    policy_objective       | 0.00652  |
|    value_loss             | 0.000173 |
----------------------------------------
----------------------------------------
| rollout/                  |          |
|    ep_len_mean            | 500      |
|    ep_rew_mean            | 500      |
| time/                     |          |
|    fps                    | 1302     |
|    iterations             | 47       |
|    time_elapsed           | 73       |
|    total_timesteps        | 96256    |
| train/                    |          |
|    explained_variance     | -1.31    |
|    is_line_search_success | 1        |
|    kl_divergence_loss     | 0.00824  |
|    learning_rate          | 0.0003   |
|    n_updates              | 46       |
|    policy_objective       | 0.00312  |
|    value_loss             | 0.000142 |
----------------------------------------
----------------------------------------
| rollout/                  |          |
|    ep_len_mean            | 500      |
|    ep_rew_mean            | 500      |
| time/                     |          |
|    fps                    | 1302     |
|    iterations             | 48       |
|    time_elapsed           | 75       |
|    total_timesteps        | 98304    |
| train/                    |          |
|    explained_variance     | -4.46    |
|    is_line_search_success | 1        |
|    kl_divergence_loss     | 0.00516  |
|    learning_rate          | 0.0003   |
|    n_updates              | 47       |
|    policy_objective       | 0.00344  |
|    value_loss             | 0.000144 |
----------------------------------------
----------------------------------------
| rollout/                  |          |
|    ep_len_mean            | 500      |
|    ep_rew_mean            | 500      |
| time/                     |          |
|    fps                    | 1302     |
|    iterations             | 49       |
|    time_elapsed           | 77       |
|    total_timesteps        | 100352   |
| train/                    |          |
|    explained_variance     | -8.76    |
|    is_line_search_success | 1        |
|    kl_divergence_loss     | 0.00787  |
|    learning_rate          | 0.0003   |
|    n_updates              | 48       |
|    policy_objective       | 0.00359  |
|    value_loss             | 0.00013  |
----------------------------------------
wandb: WARNING Symlinked 1 file into the W&B run directory; call wandb.save again to sync new files.
wandb: updating run metadata
wandb: updating run metadata; uploading model.zip; uploading output.log; uploading wandb-summary.json
wandb: uploading model.zip; uploading output.log
wandb: uploading logs/CartPole_gravity_sine_Baseline_20251217_125255_0/events.out.tfevents.1765950969.hungchan-Precision-7560.39627.0
wandb: uploading history steps 390-434, summary, console lines 846-882
wandb: 
wandb: Run history:
wandb:                  global_step ▁▁▁▁▁▂▂▂▂▂▂▂▂▃▃▃▃▄▄▄▅▅▅▅▅▅▅▅▅▆▆▆▆▇▇▇▇▇██
wandb:          rollout/ep_len_mean ▁▁▁▁▁▂▂▂▃▃▃▄▄▄▅▅▅▆▆▆▇▇▇▇▇███████████████
wandb:          rollout/ep_rew_mean ▁▁▁▁▁▂▂▂▃▃▃▄▄▅▅▅▆▆▆▆▇▇▇▇▇███████████████
wandb:                     time/fps ▅▁▅▅▄▇▇▇▇▇▆▆▆▅▅▆▇▇▇▇▇▇▇▆▇▇▇▇██████▇█████
wandb:     train/explained_variance ▇▇▇███████▇█▇▇▇▇▇▇███▇▇█▇▇▇▆▆▅█▇▅██▅▇▇▆▁
wandb: train/is_line_search_success ▁▁▁▁▁▁▁▁▁▁▁▁▁▁▁▁▁▁▁▁▁▁▁▁▁▁▁▁▁▁▁▁▁▁▁▁▁▁▁▁
wandb:     train/kl_divergence_loss ▆▆▆▆▅▅▆▇▄▇▅█▆▇▄▅▅▅▅▆▅▄▅▇▃▃▄▆▃▁▆▆▇▇▄█▄▆▆▆
wandb:          train/learning_rate ▁▁▁▁▁▁▁▁▁▁▁▁▁▁▁▁▁▁▁▁▁▁▁▁▁▁▁▁▁▁▁▁▁▁▁▁▁▁▁▁
wandb:       train/policy_objective ▆███▇▅▄▇▃▄▄▆▃▂▂▃▂▅▃▅▃▂▂▃▃▂▂▃▃▁▃▃▂▃▂▄▂▃▂▂
wandb:             train/value_loss ▇▅▆▇█▅▄▃▄▂▄▂▁▁▁▁▁█▁▁▁▁▁▁▁▁▁▁▁▁▁▁▁▁▁▁▁▁▁▁
wandb: 
wandb: Run summary:
wandb:                  global_step 100352
wandb:          rollout/ep_len_mean 500
wandb:          rollout/ep_rew_mean 500
wandb:                     time/fps 1302
wandb:     train/explained_variance -8.75805
wandb: train/is_line_search_success 1
wandb:     train/kl_divergence_loss 0.00787
wandb:          train/learning_rate 0.0003
wandb:       train/policy_objective 0.00359
wandb:             train/value_loss 0.00013
wandb: 
wandb: 🚀 View run CartPole_gravity_sine_Baseline_20251217_125255 at: https://wandb.ai/hungtrab-hanoi-university-of-science-and-technology/CartPole_Drift_Research_TRPO/runs/r8393xfb
wandb: ⭐️ View project at: https://wandb.ai/hungtrab-hanoi-university-of-science-and-technology/CartPole_Drift_Research_TRPO
wandb: Synced 6 W&B file(s), 0 media file(s), 0 artifact file(s) and 2 other file(s)
wandb: Find logs at: logs/CartPole_gravity_sine_Baseline_20251217_125255/wandb/run-20251217_125601-r8393xfb/logs
Model saved locally to: models/CartPole_gravity_sine_Baseline_20251217_125255.zip
