wandb: Currently logged in as: hungtrab (hungtrab-hanoi-university-of-science-and-technology) to https://api.wandb.ai. Use `wandb login --relogin` to force relogin
wandb: setting up run 91la244b
wandb: Tracking run with wandb version 0.23.1
wandb: Run data is saved locally in logs/CartPole_length_linear_Baseline_20251217_125255/wandb/run-20251217_130247-91la244b
wandb: Run `wandb offline` to turn off syncing.
wandb: Syncing run CartPole_length_linear_Baseline_20251217_125255
wandb: ⭐️ View project at https://wandb.ai/hungtrab-hanoi-university-of-science-and-technology/CartPole_Drift_Research_TRPO
wandb: 🚀 View run at https://wandb.ai/hungtrab-hanoi-university-of-science-and-technology/CartPole_Drift_Research_TRPO/runs/91la244b
/home/hungchan/miniconda3/envs/rl_hf_course/lib/python3.10/site-packages/stable_baselines3/common/on_policy_algorithm.py:150: UserWarning: You are trying to run TRPO on the GPU, but it is primarily intended to run on the CPU when not using a CNN policy (you are using ActorCriticPolicy which should be a MlpPolicy). See https://github.com/DLR-RM/stable-baselines3/issues/1245 for more info. You can pass `device='cpu'` or `export CUDA_VISIBLE_DEVICES=` to force using the CPU.Note: The model will train, but the GPU utilization will be poor and the training might take longer than on CPU.
  warnings.warn(
--- Training Start: CartPole_length_linear_Baseline_20251217_125255 ---
>>> [Wrapper] Initialized Non-Stationary CartPole
    - length: linear (magnitude=0.3, period=25000)
>>> Initializing TRPO with kwargs: ['policy', 'env', 'learning_rate', 'gamma', 'verbose', 'tensorboard_log', 'n_steps', 'batch_size']
Using cuda device
Wrapping the env in a DummyVecEnv.
Logging to logs/CartPole_length_linear_Baseline_20251217_125255_0
---------------------------------
| rollout/           |          |
|    ep_len_mean     | 23.7     |
|    ep_rew_mean     | 23.7     |
| time/              |          |
|    fps             | 1416     |
|    iterations      | 1        |
|    time_elapsed    | 1        |
|    total_timesteps | 2048     |
---------------------------------
----------------------------------------
| rollout/                  |          |
|    ep_len_mean            | 27.4     |
|    ep_rew_mean            | 27.4     |
| time/                     |          |
|    fps                    | 1318     |
|    iterations             | 2        |
|    time_elapsed           | 3        |
|    total_timesteps        | 4096     |
| train/                    |          |
|    explained_variance     | 0.00127  |
|    is_line_search_success | 1        |
|    kl_divergence_loss     | 0.00794  |
|    learning_rate          | 0.0003   |
|    n_updates              | 1        |
|    policy_objective       | 0.0197   |
|    value_loss             | 52.6     |
----------------------------------------
----------------------------------------
| rollout/                  |          |
|    ep_len_mean            | 34.5     |
|    ep_rew_mean            | 34.5     |
| time/                     |          |
|    fps                    | 1327     |
|    iterations             | 3        |
|    time_elapsed           | 4        |
|    total_timesteps        | 6144     |
| train/                    |          |
|    explained_variance     | 0.0711   |
|    is_line_search_success | 1        |
|    kl_divergence_loss     | 0.00833  |
|    learning_rate          | 0.0003   |
|    n_updates              | 2        |
|    policy_objective       | 0.0196   |
|    value_loss             | 38.6     |
----------------------------------------
----------------------------------------
| rollout/                  |          |
|    ep_len_mean            | 41.9     |
|    ep_rew_mean            | 41.9     |
| time/                     |          |
|    fps                    | 1322     |
|    iterations             | 4        |
|    time_elapsed           | 6        |
|    total_timesteps        | 8192     |
| train/                    |          |
|    explained_variance     | 0.152    |
|    is_line_search_success | 1        |
|    kl_divergence_loss     | 0.00791  |
|    learning_rate          | 0.0003   |
|    n_updates              | 3        |
|    policy_objective       | 0.0228   |
|    value_loss             | 51.4     |
----------------------------------------
----------------------------------------
| rollout/                  |          |
|    ep_len_mean            | 55.8     |
|    ep_rew_mean            | 55.8     |
| time/                     |          |
|    fps                    | 1317     |
|    iterations             | 5        |
|    time_elapsed           | 7        |
|    total_timesteps        | 10240    |
| train/                    |          |
|    explained_variance     | 0.219    |
|    is_line_search_success | 1        |
|    kl_divergence_loss     | 0.00717  |
|    learning_rate          | 0.0003   |
|    n_updates              | 4        |
|    policy_objective       | 0.0296   |
|    value_loss             | 61.1     |
----------------------------------------
----------------------------------------
| rollout/                  |          |
|    ep_len_mean            | 69       |
|    ep_rew_mean            | 69       |
| time/                     |          |
|    fps                    | 1314     |
|    iterations             | 6        |
|    time_elapsed           | 9        |
|    total_timesteps        | 12288    |
| train/                    |          |
|    explained_variance     | 0.144    |
|    is_line_search_success | 1        |
|    kl_divergence_loss     | 0.00743  |
|    learning_rate          | 0.0003   |
|    n_updates              | 5        |
|    policy_objective       | 0.0254   |
|    value_loss             | 60.8     |
----------------------------------------
----------------------------------------
| rollout/                  |          |
|    ep_len_mean            | 85.4     |
|    ep_rew_mean            | 85.4     |
| time/                     |          |
|    fps                    | 1319     |
|    iterations             | 7        |
|    time_elapsed           | 10       |
|    total_timesteps        | 14336    |
| train/                    |          |
|    explained_variance     | 0.308    |
|    is_line_search_success | 1        |
|    kl_divergence_loss     | 0.00619  |
|    learning_rate          | 0.0003   |
|    n_updates              | 6        |
|    policy_objective       | 0.013    |
|    value_loss             | 71.6     |
----------------------------------------
----------------------------------------
| rollout/                  |          |
|    ep_len_mean            | 103      |
|    ep_rew_mean            | 103      |
| time/                     |          |
|    fps                    | 1319     |
|    iterations             | 8        |
|    time_elapsed           | 12       |
|    total_timesteps        | 16384    |
| train/                    |          |
|    explained_variance     | 0.656    |
|    is_line_search_success | 1        |
|    kl_divergence_loss     | 0.00861  |
|    learning_rate          | 0.0003   |
|    n_updates              | 7        |
|    policy_objective       | 0.0208   |
|    value_loss             | 38.3     |
----------------------------------------
----------------------------------------
| rollout/                  |          |
|    ep_len_mean            | 120      |
|    ep_rew_mean            | 120      |
| time/                     |          |
|    fps                    | 1322     |
|    iterations             | 9        |
|    time_elapsed           | 13       |
|    total_timesteps        | 18432    |
| train/                    |          |
|    explained_variance     | 0.761    |
|    is_line_search_success | 1        |
|    kl_divergence_loss     | 0.00466  |
|    learning_rate          | 0.0003   |
|    n_updates              | 8        |
|    policy_objective       | 0.0131   |
|    value_loss             | 36.9     |
----------------------------------------
----------------------------------------
| rollout/                  |          |
|    ep_len_mean            | 139      |
|    ep_rew_mean            | 139      |
| time/                     |          |
|    fps                    | 1325     |
|    iterations             | 10       |
|    time_elapsed           | 15       |
|    total_timesteps        | 20480    |
| train/                    |          |
|    explained_variance     | 0.932    |
|    is_line_search_success | 1        |
|    kl_divergence_loss     | 0.00756  |
|    learning_rate          | 0.0003   |
|    n_updates              | 9        |
|    policy_objective       | 0.0148   |
|    value_loss             | 16.3     |
----------------------------------------
----------------------------------------
| rollout/                  |          |
|    ep_len_mean            | 153      |
|    ep_rew_mean            | 153      |
| time/                     |          |
|    fps                    | 1324     |
|    iterations             | 11       |
|    time_elapsed           | 17       |
|    total_timesteps        | 22528    |
| train/                    |          |
|    explained_variance     | 0.947    |
|    is_line_search_success | 1        |
|    kl_divergence_loss     | 0.00816  |
|    learning_rate          | 0.0003   |
|    n_updates              | 10       |
|    policy_objective       | 0.0113   |
|    value_loss             | 13.1     |
----------------------------------------
----------------------------------------
| rollout/                  |          |
|    ep_len_mean            | 173      |
|    ep_rew_mean            | 173      |
| time/                     |          |
|    fps                    | 1327     |
|    iterations             | 12       |
|    time_elapsed           | 18       |
|    total_timesteps        | 24576    |
| train/                    |          |
|    explained_variance     | 0.844    |
|    is_line_search_success | 1        |
|    kl_divergence_loss     | 0.00715  |
|    learning_rate          | 0.0003   |
|    n_updates              | 11       |
|    policy_objective       | 0.0167   |
|    value_loss             | 28.5     |
----------------------------------------
----------------------------------------
| rollout/                  |          |
|    ep_len_mean            | 192      |
|    ep_rew_mean            | 192      |
| time/                     |          |
|    fps                    | 1330     |
|    iterations             | 13       |
|    time_elapsed           | 20       |
|    total_timesteps        | 26624    |
| train/                    |          |
|    explained_variance     | 0.952    |
|    is_line_search_success | 1        |
|    kl_divergence_loss     | 0.00911  |
|    learning_rate          | 0.0003   |
|    n_updates              | 12       |
|    policy_objective       | 0.0148   |
|    value_loss             | 8.26     |
----------------------------------------
----------------------------------------
| rollout/                  |          |
|    ep_len_mean            | 209      |
|    ep_rew_mean            | 209      |
| time/                     |          |
|    fps                    | 1325     |
|    iterations             | 14       |
|    time_elapsed           | 21       |
|    total_timesteps        | 28672    |
| train/                    |          |
|    explained_variance     | 0.892    |
|    is_line_search_success | 1        |
|    kl_divergence_loss     | 0.00958  |
|    learning_rate          | 0.0003   |
|    n_updates              | 13       |
|    policy_objective       | 0.0287   |
|    value_loss             | 5.58     |
----------------------------------------
----------------------------------------
| rollout/                  |          |
|    ep_len_mean            | 227      |
|    ep_rew_mean            | 227      |
| time/                     |          |
|    fps                    | 1321     |
|    iterations             | 15       |
|    time_elapsed           | 23       |
|    total_timesteps        | 30720    |
| train/                    |          |
|    explained_variance     | 0.00893  |
|    is_line_search_success | 1        |
|    kl_divergence_loss     | 0.00817  |
|    learning_rate          | 0.0003   |
|    n_updates              | 14       |
|    policy_objective       | 0.0207   |
|    value_loss             | 63.7     |
----------------------------------------
----------------------------------------
| rollout/                  |          |
|    ep_len_mean            | 246      |
|    ep_rew_mean            | 246      |
| time/                     |          |
|    fps                    | 1322     |
|    iterations             | 16       |
|    time_elapsed           | 24       |
|    total_timesteps        | 32768    |
| train/                    |          |
|    explained_variance     | 0.725    |
|    is_line_search_success | 1        |
|    kl_divergence_loss     | 0.00934  |
|    learning_rate          | 0.0003   |
|    n_updates              | 15       |
|    policy_objective       | 0.0254   |
|    value_loss             | 4.18     |
----------------------------------------
----------------------------------------
| rollout/                  |          |
|    ep_len_mean            | 264      |
|    ep_rew_mean            | 264      |
| time/                     |          |
|    fps                    | 1318     |
|    iterations             | 17       |
|    time_elapsed           | 26       |
|    total_timesteps        | 34816    |
| train/                    |          |
|    explained_variance     | 0.59     |
|    is_line_search_success | 1        |
|    kl_divergence_loss     | 0.00785  |
|    learning_rate          | 0.0003   |
|    n_updates              | 16       |
|    policy_objective       | 0.0235   |
|    value_loss             | 13.2     |
----------------------------------------
----------------------------------------
| rollout/                  |          |
|    ep_len_mean            | 276      |
|    ep_rew_mean            | 276      |
| time/                     |          |
|    fps                    | 1320     |
|    iterations             | 18       |
|    time_elapsed           | 27       |
|    total_timesteps        | 36864    |
| train/                    |          |
|    explained_variance     | 0.965    |
|    is_line_search_success | 1        |
|    kl_divergence_loss     | 0.00844  |
|    learning_rate          | 0.0003   |
|    n_updates              | 17       |
|    policy_objective       | 0.0105   |
|    value_loss             | 7.73     |
----------------------------------------
----------------------------------------
| rollout/                  |          |
|    ep_len_mean            | 293      |
|    ep_rew_mean            | 293      |
| time/                     |          |
|    fps                    | 1322     |
|    iterations             | 19       |
|    time_elapsed           | 29       |
|    total_timesteps        | 38912    |
| train/                    |          |
|    explained_variance     | 0.982    |
|    is_line_search_success | 1        |
|    kl_divergence_loss     | 0.00488  |
|    learning_rate          | 0.0003   |
|    n_updates              | 18       |
|    policy_objective       | 0.0103   |
|    value_loss             | 2.87     |
----------------------------------------
----------------------------------------
| rollout/                  |          |
|    ep_len_mean            | 308      |
|    ep_rew_mean            | 308      |
| time/                     |          |
|    fps                    | 1324     |
|    iterations             | 20       |
|    time_elapsed           | 30       |
|    total_timesteps        | 40960    |
| train/                    |          |
|    explained_variance     | 0.971    |
|    is_line_search_success | 1        |
|    kl_divergence_loss     | 0.00794  |
|    learning_rate          | 0.0003   |
|    n_updates              | 19       |
|    policy_objective       | 0.023    |
|    value_loss             | 1.02     |
----------------------------------------
----------------------------------------
| rollout/                  |          |
|    ep_len_mean            | 324      |
|    ep_rew_mean            | 324      |
| time/                     |          |
|    fps                    | 1325     |
|    iterations             | 21       |
|    time_elapsed           | 32       |
|    total_timesteps        | 43008    |
| train/                    |          |
|    explained_variance     | 0.989    |
|    is_line_search_success | 1        |
|    kl_divergence_loss     | 0.00798  |
|    learning_rate          | 0.0003   |
|    n_updates              | 20       |
|    policy_objective       | 0.0399   |
|    value_loss             | 0.493    |
----------------------------------------
----------------------------------------
| rollout/                  |          |
|    ep_len_mean            | 341      |
|    ep_rew_mean            | 341      |
| time/                     |          |
|    fps                    | 1323     |
|    iterations             | 22       |
|    time_elapsed           | 34       |
|    total_timesteps        | 45056    |
| train/                    |          |
|    explained_variance     | 0.802    |
|    is_line_search_success | 1        |
|    kl_divergence_loss     | 0.00996  |
|    learning_rate          | 0.0003   |
|    n_updates              | 21       |
|    policy_objective       | 0.0227   |
|    value_loss             | 0.21     |
----------------------------------------
----------------------------------------
| rollout/                  |          |
|    ep_len_mean            | 355      |
|    ep_rew_mean            | 355      |
| time/                     |          |
|    fps                    | 1321     |
|    iterations             | 23       |
|    time_elapsed           | 35       |
|    total_timesteps        | 47104    |
| train/                    |          |
|    explained_variance     | 0.386    |
|    is_line_search_success | 1        |
|    kl_divergence_loss     | 0.00906  |
|    learning_rate          | 0.0003   |
|    n_updates              | 22       |
|    policy_objective       | 0.00623  |
|    value_loss             | 0.132    |
----------------------------------------
----------------------------------------
| rollout/                  |          |
|    ep_len_mean            | 372      |
|    ep_rew_mean            | 372      |
| time/                     |          |
|    fps                    | 1323     |
|    iterations             | 24       |
|    time_elapsed           | 37       |
|    total_timesteps        | 49152    |
| train/                    |          |
|    explained_variance     | 0.0762   |
|    is_line_search_success | 1        |
|    kl_divergence_loss     | 0.00966  |
|    learning_rate          | 0.0003   |
|    n_updates              | 23       |
|    policy_objective       | 0.00645  |
|    value_loss             | 0.0832   |
----------------------------------------
----------------------------------------
| rollout/                  |          |
|    ep_len_mean            | 387      |
|    ep_rew_mean            | 387      |
| time/                     |          |
|    fps                    | 1324     |
|    iterations             | 25       |
|    time_elapsed           | 38       |
|    total_timesteps        | 51200    |
| train/                    |          |
|    explained_variance     | 0.00932  |
|    is_line_search_success | 1        |
|    kl_divergence_loss     | 0.00919  |
|    learning_rate          | 0.0003   |
|    n_updates              | 24       |
|    policy_objective       | 0.00866  |
|    value_loss             | 0.0539   |
----------------------------------------
----------------------------------------
| rollout/                  |          |
|    ep_len_mean            | 400      |
|    ep_rew_mean            | 400      |
| time/                     |          |
|    fps                    | 1323     |
|    iterations             | 26       |
|    time_elapsed           | 40       |
|    total_timesteps        | 53248    |
| train/                    |          |
|    explained_variance     | 0.00423  |
|    is_line_search_success | 1        |
|    kl_divergence_loss     | 0.0074   |
|    learning_rate          | 0.0003   |
|    n_updates              | 25       |
|    policy_objective       | 0.00787  |
|    value_loss             | 29.6     |
----------------------------------------
----------------------------------------
| rollout/                  |          |
|    ep_len_mean            | 414      |
|    ep_rew_mean            | 414      |
| time/                     |          |
|    fps                    | 1325     |
|    iterations             | 27       |
|    time_elapsed           | 41       |
|    total_timesteps        | 55296    |
| train/                    |          |
|    explained_variance     | -0.0415  |
|    is_line_search_success | 1        |
|    kl_divergence_loss     | 0.00699  |
|    learning_rate          | 0.0003   |
|    n_updates              | 26       |
|    policy_objective       | 0.00613  |
|    value_loss             | 0.907    |
----------------------------------------
----------------------------------------
| rollout/                  |          |
|    ep_len_mean            | 427      |
|    ep_rew_mean            | 427      |
| time/                     |          |
|    fps                    | 1326     |
|    iterations             | 28       |
|    time_elapsed           | 43       |
|    total_timesteps        | 57344    |
| train/                    |          |
|    explained_variance     | 0.453    |
|    is_line_search_success | 1        |
|    kl_divergence_loss     | 0.00899  |
|    learning_rate          | 0.0003   |
|    n_updates              | 27       |
|    policy_objective       | 0.00958  |
|    value_loss             | 0.0451   |
----------------------------------------
----------------------------------------
| rollout/                  |          |
|    ep_len_mean            | 436      |
|    ep_rew_mean            | 436      |
| time/                     |          |
|    fps                    | 1327     |
|    iterations             | 29       |
|    time_elapsed           | 44       |
|    total_timesteps        | 59392    |
| train/                    |          |
|    explained_variance     | 0.26     |
|    is_line_search_success | 1        |
|    kl_divergence_loss     | 0.00917  |
|    learning_rate          | 0.0003   |
|    n_updates              | 28       |
|    policy_objective       | 0.00658  |
|    value_loss             | 0.0136   |
----------------------------------------
----------------------------------------
| rollout/                  |          |
|    ep_len_mean            | 446      |
|    ep_rew_mean            | 446      |
| time/                     |          |
|    fps                    | 1325     |
|    iterations             | 30       |
|    time_elapsed           | 46       |
|    total_timesteps        | 61440    |
| train/                    |          |
|    explained_variance     | -0.0737  |
|    is_line_search_success | 1        |
|    kl_divergence_loss     | 0.00953  |
|    learning_rate          | 0.0003   |
|    n_updates              | 29       |
|    policy_objective       | 0.0144   |
|    value_loss             | 0.0082   |
----------------------------------------
----------------------------------------
| rollout/                  |          |
|    ep_len_mean            | 447      |
|    ep_rew_mean            | 447      |
| time/                     |          |
|    fps                    | 1323     |
|    iterations             | 31       |
|    time_elapsed           | 47       |
|    total_timesteps        | 63488    |
| train/                    |          |
|    explained_variance     | -0.477   |
|    is_line_search_success | 1        |
|    kl_divergence_loss     | 0.00989  |
|    learning_rate          | 0.0003   |
|    n_updates              | 30       |
|    policy_objective       | 0.0055   |
|    value_loss             | 0.00495  |
----------------------------------------
----------------------------------------
| rollout/                  |          |
|    ep_len_mean            | 455      |
|    ep_rew_mean            | 455      |
| time/                     |          |
|    fps                    | 1321     |
|    iterations             | 32       |
|    time_elapsed           | 49       |
|    total_timesteps        | 65536    |
| train/                    |          |
|    explained_variance     | 0.0245   |
|    is_line_search_success | 1        |
|    kl_divergence_loss     | 0.00654  |
|    learning_rate          | 0.0003   |
|    n_updates              | 31       |
|    policy_objective       | 0.0126   |
|    value_loss             | 87.1     |
----------------------------------------
----------------------------------------
| rollout/                  |          |
|    ep_len_mean            | 461      |
|    ep_rew_mean            | 461      |
| time/                     |          |
|    fps                    | 1319     |
|    iterations             | 33       |
|    time_elapsed           | 51       |
|    total_timesteps        | 67584    |
| train/                    |          |
|    explained_variance     | -3.01    |
|    is_line_search_success | 1        |
|    kl_divergence_loss     | 0.00672  |
|    learning_rate          | 0.0003   |
|    n_updates              | 32       |
|    policy_objective       | 0.00951  |
|    value_loss             | 2.32     |
----------------------------------------
----------------------------------------
| rollout/                  |          |
|    ep_len_mean            | 466      |
|    ep_rew_mean            | 466      |
| time/                     |          |
|    fps                    | 1320     |
|    iterations             | 34       |
|    time_elapsed           | 52       |
|    total_timesteps        | 69632    |
| train/                    |          |
|    explained_variance     | -1.08    |
|    is_line_search_success | 1        |
|    kl_divergence_loss     | 0.00773  |
|    learning_rate          | 0.0003   |
|    n_updates              | 33       |
|    policy_objective       | 0.016    |
|    value_loss             | 0.0464   |
----------------------------------------
----------------------------------------
| rollout/                  |          |
|    ep_len_mean            | 468      |
|    ep_rew_mean            | 468      |
| time/                     |          |
|    fps                    | 1321     |
|    iterations             | 35       |
|    time_elapsed           | 54       |
|    total_timesteps        | 71680    |
| train/                    |          |
|    explained_variance     | -5.53    |
|    is_line_search_success | 1        |
|    kl_divergence_loss     | 0.00732  |
|    learning_rate          | 0.0003   |
|    n_updates              | 34       |
|    policy_objective       | 0.00533  |
|    value_loss             | 0.0471   |
----------------------------------------
----------------------------------------
| rollout/                  |          |
|    ep_len_mean            | 468      |
|    ep_rew_mean            | 468      |
| time/                     |          |
|    fps                    | 1321     |
|    iterations             | 36       |
|    time_elapsed           | 55       |
|    total_timesteps        | 73728    |
| train/                    |          |
|    explained_variance     | -2.38    |
|    is_line_search_success | 1        |
|    kl_divergence_loss     | 0.00819  |
|    learning_rate          | 0.0003   |
|    n_updates              | 35       |
|    policy_objective       | 0.0093   |
|    value_loss             | 0.0121   |
----------------------------------------
----------------------------------------
| rollout/                  |          |
|    ep_len_mean            | 474      |
|    ep_rew_mean            | 474      |
| time/                     |          |
|    fps                    | 1321     |
|    iterations             | 37       |
|    time_elapsed           | 57       |
|    total_timesteps        | 75776    |
| train/                    |          |
|    explained_variance     | -3.56    |
|    is_line_search_success | 1        |
|    kl_divergence_loss     | 0.00617  |
|    learning_rate          | 0.0003   |
|    n_updates              | 36       |
|    policy_objective       | 0.0212   |
|    value_loss             | 0.0157   |
----------------------------------------
----------------------------------------
| rollout/                  |          |
|    ep_len_mean            | 477      |
|    ep_rew_mean            | 477      |
| time/                     |          |
|    fps                    | 1320     |
|    iterations             | 38       |
|    time_elapsed           | 58       |
|    total_timesteps        | 77824    |
| train/                    |          |
|    explained_variance     | -3.68    |
|    is_line_search_success | 1        |
|    kl_divergence_loss     | 0.00652  |
|    learning_rate          | 0.0003   |
|    n_updates              | 37       |
|    policy_objective       | 0.0036   |
|    value_loss             | 0.013    |
----------------------------------------
----------------------------------------
| rollout/                  |          |
|    ep_len_mean            | 477      |
|    ep_rew_mean            | 477      |
| time/                     |          |
|    fps                    | 1321     |
|    iterations             | 39       |
|    time_elapsed           | 60       |
|    total_timesteps        | 79872    |
| train/                    |          |
|    explained_variance     | -3.31    |
|    is_line_search_success | 1        |
|    kl_divergence_loss     | 0.00709  |
|    learning_rate          | 0.0003   |
|    n_updates              | 38       |
|    policy_objective       | 0.00652  |
|    value_loss             | 0.014    |
----------------------------------------
----------------------------------------
| rollout/                  |          |
|    ep_len_mean            | 482      |
|    ep_rew_mean            | 482      |
| time/                     |          |
|    fps                    | 1321     |
|    iterations             | 40       |
|    time_elapsed           | 61       |
|    total_timesteps        | 81920    |
| train/                    |          |
|    explained_variance     | -4.21    |
|    is_line_search_success | 1        |
|    kl_divergence_loss     | 0.00746  |
|    learning_rate          | 0.0003   |
|    n_updates              | 39       |
|    policy_objective       | 0.00707  |
|    value_loss             | 0.00994  |
----------------------------------------
----------------------------------------
| rollout/                  |          |
|    ep_len_mean            | 486      |
|    ep_rew_mean            | 486      |
| time/                     |          |
|    fps                    | 1322     |
|    iterations             | 41       |
|    time_elapsed           | 63       |
|    total_timesteps        | 83968    |
| train/                    |          |
|    explained_variance     | -3.01    |
|    is_line_search_success | 1        |
|    kl_divergence_loss     | 0.00754  |
|    learning_rate          | 0.0003   |
|    n_updates              | 40       |
|    policy_objective       | 0.00426  |
|    value_loss             | 0.00848  |
----------------------------------------
----------------------------------------
| rollout/                  |          |
|    ep_len_mean            | 487      |
|    ep_rew_mean            | 487      |
| time/                     |          |
|    fps                    | 1323     |
|    iterations             | 42       |
|    time_elapsed           | 64       |
|    total_timesteps        | 86016    |
| train/                    |          |
|    explained_variance     | -5.08    |
|    is_line_search_success | 1        |
|    kl_divergence_loss     | 0.00715  |
|    learning_rate          | 0.0003   |
|    n_updates              | 41       |
|    policy_objective       | 0.00464  |
|    value_loss             | 0.00634  |
----------------------------------------
----------------------------------------
| rollout/                  |          |
|    ep_len_mean            | 487      |
|    ep_rew_mean            | 487      |
| time/                     |          |
|    fps                    | 1324     |
|    iterations             | 43       |
|    time_elapsed           | 66       |
|    total_timesteps        | 88064    |
| train/                    |          |
|    explained_variance     | -4.03    |
|    is_line_search_success | 1        |
|    kl_divergence_loss     | 0.00708  |
|    learning_rate          | 0.0003   |
|    n_updates              | 42       |
|    policy_objective       | 0.00325  |
|    value_loss             | 0.00693  |
----------------------------------------
----------------------------------------
| rollout/                  |          |
|    ep_len_mean            | 487      |
|    ep_rew_mean            | 487      |
| time/                     |          |
|    fps                    | 1324     |
|    iterations             | 44       |
|    time_elapsed           | 68       |
|    total_timesteps        | 90112    |
| train/                    |          |
|    explained_variance     | -4.88    |
|    is_line_search_success | 1        |
|    kl_divergence_loss     | 0.00766  |
|    learning_rate          | 0.0003   |
|    n_updates              | 43       |
|    policy_objective       | 0.00768  |
|    value_loss             | 0.0104   |
----------------------------------------
----------------------------------------
| rollout/                  |          |
|    ep_len_mean            | 487      |
|    ep_rew_mean            | 487      |
| time/                     |          |
|    fps                    | 1324     |
|    iterations             | 45       |
|    time_elapsed           | 69       |
|    total_timesteps        | 92160    |
| train/                    |          |
|    explained_variance     | -5.48    |
|    is_line_search_success | 1        |
|    kl_divergence_loss     | 0.0075   |
|    learning_rate          | 0.0003   |
|    n_updates              | 44       |
|    policy_objective       | 0.00596  |
|    value_loss             | 0.0114   |
----------------------------------------
----------------------------------------
| rollout/                  |          |
|    ep_len_mean            | 487      |
|    ep_rew_mean            | 487      |
| time/                     |          |
|    fps                    | 1324     |
|    iterations             | 46       |
|    time_elapsed           | 71       |
|    total_timesteps        | 94208    |
| train/                    |          |
|    explained_variance     | -4.61    |
|    is_line_search_success | 1        |
|    kl_divergence_loss     | 0.00776  |
|    learning_rate          | 0.0003   |
|    n_updates              | 45       |
|    policy_objective       | 0.00468  |
|    value_loss             | 0.00331  |
----------------------------------------
----------------------------------------
| rollout/                  |          |
|    ep_len_mean            | 487      |
|    ep_rew_mean            | 487      |
| time/                     |          |
|    fps                    | 1324     |
|    iterations             | 47       |
|    time_elapsed           | 72       |
|    total_timesteps        | 96256    |
| train/                    |          |
|    explained_variance     | -1.86    |
|    is_line_search_success | 1        |
|    kl_divergence_loss     | 0.00624  |
|    learning_rate          | 0.0003   |
|    n_updates              | 46       |
|    policy_objective       | 0.00349  |
|    value_loss             | 0.0053   |
----------------------------------------
----------------------------------------
| rollout/                  |          |
|    ep_len_mean            | 487      |
|    ep_rew_mean            | 487      |
| time/                     |          |
|    fps                    | 1323     |
|    iterations             | 48       |
|    time_elapsed           | 74       |
|    total_timesteps        | 98304    |
| train/                    |          |
|    explained_variance     | -5.52    |
|    is_line_search_success | 1        |
|    kl_divergence_loss     | 0.00685  |
|    learning_rate          | 0.0003   |
|    n_updates              | 47       |
|    policy_objective       | 0.00313  |
|    value_loss             | 0.00161  |
----------------------------------------
----------------------------------------
| rollout/                  |          |
|    ep_len_mean            | 488      |
|    ep_rew_mean            | 488      |
| time/                     |          |
|    fps                    | 1323     |
|    iterations             | 49       |
|    time_elapsed           | 75       |
|    total_timesteps        | 100352   |
| train/                    |          |
|    explained_variance     | -1.21    |
|    is_line_search_success | 1        |
|    kl_divergence_loss     | 0.00609  |
|    learning_rate          | 0.0003   |
|    n_updates              | 48       |
|    policy_objective       | 0.00432  |
|    value_loss             | 0.00209  |
----------------------------------------
wandb: WARNING Symlinked 1 file into the W&B run directory; call wandb.save again to sync new files.
wandb: updating run metadata
wandb: uploading model.zip; uploading output.log; uploading wandb-summary.json
wandb: uploading model.zip; uploading output.log; uploading wandb-summary.json; uploading config.yaml; uploading logs/CartPole_length_linear_Baseline_20251217_125255_0/events.out.tfevents.1765951374.hungchan-Precision-7560.44246.0
wandb: uploading model.zip; uploading wandb-summary.json; uploading config.yaml; uploading logs/CartPole_length_linear_Baseline_20251217_125255_0/events.out.tfevents.1765951374.hungchan-Precision-7560.44246.0
wandb: uploading model.zip; uploading logs/CartPole_length_linear_Baseline_20251217_125255_0/events.out.tfevents.1765951374.hungchan-Precision-7560.44246.0
wandb: uploading history steps 399-434, summary, console lines 864-882
wandb: 
wandb: Run history:
wandb:                  global_step ▁▁▁▂▂▂▂▂▃▃▃▃▃▃▄▄▄▅▅▅▅▅▅▆▆▆▆▆▆▇▇▇▇▇▇█████
wandb:          rollout/ep_len_mean ▁▁▁▁▂▂▂▃▃▃▄▄▄▅▅▅▆▆▆▆▇▇▇▇▇▇██████████████
wandb:          rollout/ep_rew_mean ▁▁▁▁▁▂▂▂▃▃▄▄▄▄▅▅▅▆▆▆▆▇▇▇▇▇██████████████
wandb:                     time/fps █▁▂▁▁▁▁▁▂▁▂▂▁▁▁▁▁▂▁▁▁▂▂▂▂▁▁▁▁▁▁▁▁▁▁▁▁▁▁▁
wandb:     train/explained_variance ▇▇▇▇▇██████▇██████▇▇▇▇▇▇▇▇▄▆▁▄▃▃▂▄▁▂▁▂▅▆
wandb: train/is_line_search_success ▁▁▁▁▁▁▁▁▁▁▁▁▁▁▁▁▁▁▁▁▁▁▁▁▁▁▁▁▁▁▁▁▁▁▁▁▁▁▁▁
wandb:     train/kl_divergence_loss ▅▆▅▄▅▆▁▅▆▄▇▆▇▅▆▅▅█▇█▅▄▇▇▇▃▄▅▅▆▃▄▅▅▄▅▅▅▃▃
wandb:          train/learning_rate ▁▁▁▁▁▁▁▁▁▁▁▁▁▁▁▁▁▁▁▁▁▁▁▁▁▁▁▁▁▁▁▁▁▁▁▁▁▁▁▁
wandb:       train/policy_objective ▄▄▅▆▅▄▃▃▂▄▆▄▅▅▂▅█▅▂▂▂▂▂▂▃▃▂▃▁▂▁▂▂▁▁▂▁▁▁▁
wandb:             train/value_loss ▅▄▅▆▆▄▄▂▂▃▁▆▁▂▂▁▁▁▁▁▃▁▁▁▁█▁▁▁▁▁▁▁▁▁▁▁▁▁▁
wandb: 
wandb: Run summary:
wandb:                  global_step 100352
wandb:          rollout/ep_len_mean 488.14
wandb:          rollout/ep_rew_mean 488.14
wandb:                     time/fps 1323
wandb:     train/explained_variance -1.21334
wandb: train/is_line_search_success 1
wandb:     train/kl_divergence_loss 0.00609
wandb:          train/learning_rate 0.0003
wandb:       train/policy_objective 0.00432
wandb:             train/value_loss 0.00209
wandb: 
wandb: 🚀 View run CartPole_length_linear_Baseline_20251217_125255 at: https://wandb.ai/hungtrab-hanoi-university-of-science-and-technology/CartPole_Drift_Research_TRPO/runs/91la244b
wandb: ⭐️ View project at: https://wandb.ai/hungtrab-hanoi-university-of-science-and-technology/CartPole_Drift_Research_TRPO
wandb: Synced 6 W&B file(s), 0 media file(s), 0 artifact file(s) and 2 other file(s)
wandb: Find logs at: logs/CartPole_length_linear_Baseline_20251217_125255/wandb/run-20251217_130247-91la244b/logs
Model saved locally to: models/CartPole_length_linear_Baseline_20251217_125255.zip
