wandb: Currently logged in as: hungtrab (hungtrab-hanoi-university-of-science-and-technology) to https://api.wandb.ai. Use `wandb login --relogin` to force relogin
wandb: setting up run zpqkcftt
wandb: Tracking run with wandb version 0.23.1
wandb: Run data is saved locally in logs/CartPole_masscart_random_walk_Baseline_20251217_125255/wandb/run-20251217_125904-zpqkcftt
wandb: Run `wandb offline` to turn off syncing.
wandb: Syncing run CartPole_masscart_random_walk_Baseline_20251217_125255
wandb: ⭐️ View project at https://wandb.ai/hungtrab-hanoi-university-of-science-and-technology/CartPole_Drift_Research_TRPO
wandb: 🚀 View run at https://wandb.ai/hungtrab-hanoi-university-of-science-and-technology/CartPole_Drift_Research_TRPO/runs/zpqkcftt
/home/hungchan/miniconda3/envs/rl_hf_course/lib/python3.10/site-packages/stable_baselines3/common/on_policy_algorithm.py:150: UserWarning: You are trying to run TRPO on the GPU, but it is primarily intended to run on the CPU when not using a CNN policy (you are using ActorCriticPolicy which should be a MlpPolicy). See https://github.com/DLR-RM/stable-baselines3/issues/1245 for more info. You can pass `device='cpu'` or `export CUDA_VISIBLE_DEVICES=` to force using the CPU.Note: The model will train, but the GPU utilization will be poor and the training might take longer than on CPU.
  warnings.warn(
--- Training Start: CartPole_masscart_random_walk_Baseline_20251217_125255 ---
>>> [Wrapper] Initialized Non-Stationary CartPole
    - masscart: random_walk (magnitude=0.5, period=10000)
>>> Initializing TRPO with kwargs: ['policy', 'env', 'learning_rate', 'gamma', 'verbose', 'tensorboard_log', 'n_steps', 'batch_size']
Using cuda device
Wrapping the env in a DummyVecEnv.
Logging to logs/CartPole_masscart_random_walk_Baseline_20251217_125255_0
---------------------------------
| rollout/           |          |
|    ep_len_mean     | 16.6     |
|    ep_rew_mean     | 16.6     |
| time/              |          |
|    fps             | 1330     |
|    iterations      | 1        |
|    time_elapsed    | 1        |
|    total_timesteps | 2048     |
---------------------------------
----------------------------------------
| rollout/                  |          |
|    ep_len_mean            | 13.9     |
|    ep_rew_mean            | 13.9     |
| time/                     |          |
|    fps                    | 1284     |
|    iterations             | 2        |
|    time_elapsed           | 3        |
|    total_timesteps        | 4096     |
| train/                    |          |
|    explained_variance     | -0.00721 |
|    is_line_search_success | 1        |
|    kl_divergence_loss     | 0.00874  |
|    learning_rate          | 0.0003   |
|    n_updates              | 1        |
|    policy_objective       | 0.0164   |
|    value_loss             | 48.6     |
----------------------------------------
----------------------------------------
| rollout/                  |          |
|    ep_len_mean            | 26.2     |
|    ep_rew_mean            | 26.2     |
| time/                     |          |
|    fps                    | 1277     |
|    iterations             | 3        |
|    time_elapsed           | 4        |
|    total_timesteps        | 6144     |
| train/                    |          |
|    explained_variance     | 0.15     |
|    is_line_search_success | 1        |
|    kl_divergence_loss     | 0.00788  |
|    learning_rate          | 0.0003   |
|    n_updates              | 2        |
|    policy_objective       | 0.0212   |
|    value_loss             | 33       |
----------------------------------------
----------------------------------------
| rollout/                  |          |
|    ep_len_mean            | 40.2     |
|    ep_rew_mean            | 40.2     |
| time/                     |          |
|    fps                    | 1279     |
|    iterations             | 4        |
|    time_elapsed           | 6        |
|    total_timesteps        | 8192     |
| train/                    |          |
|    explained_variance     | 0.164    |
|    is_line_search_success | 1        |
|    kl_divergence_loss     | 0.00748  |
|    learning_rate          | 0.0003   |
|    n_updates              | 3        |
|    policy_objective       | 0.0136   |
|    value_loss             | 46.7     |
----------------------------------------
----------------------------------------
| rollout/                  |          |
|    ep_len_mean            | 46.7     |
|    ep_rew_mean            | 46.7     |
| time/                     |          |
|    fps                    | 1279     |
|    iterations             | 5        |
|    time_elapsed           | 8        |
|    total_timesteps        | 10240    |
| train/                    |          |
|    explained_variance     | 0.356    |
|    is_line_search_success | 1        |
|    kl_divergence_loss     | 0.00732  |
|    learning_rate          | 0.0003   |
|    n_updates              | 4        |
|    policy_objective       | 0.0134   |
|    value_loss             | 33       |
----------------------------------------
----------------------------------------
| rollout/                  |          |
|    ep_len_mean            | 53.5     |
|    ep_rew_mean            | 53.5     |
| time/                     |          |
|    fps                    | 1287     |
|    iterations             | 6        |
|    time_elapsed           | 9        |
|    total_timesteps        | 12288    |
| train/                    |          |
|    explained_variance     | 0.459    |
|    is_line_search_success | 1        |
|    kl_divergence_loss     | 0.00696  |
|    learning_rate          | 0.0003   |
|    n_updates              | 5        |
|    policy_objective       | 0.0234   |
|    value_loss             | 59.6     |
----------------------------------------
----------------------------------------
| rollout/                  |          |
|    ep_len_mean            | 62.6     |
|    ep_rew_mean            | 62.6     |
| time/                     |          |
|    fps                    | 1295     |
|    iterations             | 7        |
|    time_elapsed           | 11       |
|    total_timesteps        | 14336    |
| train/                    |          |
|    explained_variance     | 0.677    |
|    is_line_search_success | 1        |
|    kl_divergence_loss     | 0.00663  |
|    learning_rate          | 0.0003   |
|    n_updates              | 6        |
|    policy_objective       | 0.0172   |
|    value_loss             | 29.6     |
----------------------------------------
----------------------------------------
| rollout/                  |          |
|    ep_len_mean            | 71.2     |
|    ep_rew_mean            | 71.2     |
| time/                     |          |
|    fps                    | 1293     |
|    iterations             | 8        |
|    time_elapsed           | 12       |
|    total_timesteps        | 16384    |
| train/                    |          |
|    explained_variance     | 0.554    |
|    is_line_search_success | 1        |
|    kl_divergence_loss     | 0.00746  |
|    learning_rate          | 0.0003   |
|    n_updates              | 7        |
|    policy_objective       | 0.0203   |
|    value_loss             | 70.6     |
----------------------------------------
----------------------------------------
| rollout/                  |          |
|    ep_len_mean            | 73.5     |
|    ep_rew_mean            | 73.5     |
| time/                     |          |
|    fps                    | 1292     |
|    iterations             | 9        |
|    time_elapsed           | 14       |
|    total_timesteps        | 18432    |
| train/                    |          |
|    explained_variance     | 0.663    |
|    is_line_search_success | 1        |
|    kl_divergence_loss     | 0.00642  |
|    learning_rate          | 0.0003   |
|    n_updates              | 8        |
|    policy_objective       | 0.0137   |
|    value_loss             | 30.1     |
----------------------------------------
----------------------------------------
| rollout/                  |          |
|    ep_len_mean            | 76.6     |
|    ep_rew_mean            | 76.6     |
| time/                     |          |
|    fps                    | 1288     |
|    iterations             | 10       |
|    time_elapsed           | 15       |
|    total_timesteps        | 20480    |
| train/                    |          |
|    explained_variance     | 0.843    |
|    is_line_search_success | 1        |
|    kl_divergence_loss     | 0.00605  |
|    learning_rate          | 0.0003   |
|    n_updates              | 9        |
|    policy_objective       | 0.0149   |
|    value_loss             | 23.1     |
----------------------------------------
----------------------------------------
| rollout/                  |          |
|    ep_len_mean            | 67.9     |
|    ep_rew_mean            | 67.9     |
| time/                     |          |
|    fps                    | 1281     |
|    iterations             | 11       |
|    time_elapsed           | 17       |
|    total_timesteps        | 22528    |
| train/                    |          |
|    explained_variance     | 0.905    |
|    is_line_search_success | 1        |
|    kl_divergence_loss     | 0.00536  |
|    learning_rate          | 0.0003   |
|    n_updates              | 10       |
|    policy_objective       | 0.017    |
|    value_loss             | 19.4     |
----------------------------------------
----------------------------------------
| rollout/                  |          |
|    ep_len_mean            | 67.9     |
|    ep_rew_mean            | 67.9     |
| time/                     |          |
|    fps                    | 1278     |
|    iterations             | 12       |
|    time_elapsed           | 19       |
|    total_timesteps        | 24576    |
| train/                    |          |
|    explained_variance     | 0.909    |
|    is_line_search_success | 1        |
|    kl_divergence_loss     | 0.00546  |
|    learning_rate          | 0.0003   |
|    n_updates              | 11       |
|    policy_objective       | 0.0163   |
|    value_loss             | 21.9     |
----------------------------------------
----------------------------------------
| rollout/                  |          |
|    ep_len_mean            | 71.7     |
|    ep_rew_mean            | 71.7     |
| time/                     |          |
|    fps                    | 1274     |
|    iterations             | 13       |
|    time_elapsed           | 20       |
|    total_timesteps        | 26624    |
| train/                    |          |
|    explained_variance     | 0.932    |
|    is_line_search_success | 1        |
|    kl_divergence_loss     | 0.00617  |
|    learning_rate          | 0.0003   |
|    n_updates              | 12       |
|    policy_objective       | 0.0141   |
|    value_loss             | 15.9     |
----------------------------------------
----------------------------------------
| rollout/                  |          |
|    ep_len_mean            | 81.7     |
|    ep_rew_mean            | 81.7     |
| time/                     |          |
|    fps                    | 1270     |
|    iterations             | 14       |
|    time_elapsed           | 22       |
|    total_timesteps        | 28672    |
| train/                    |          |
|    explained_variance     | 0.933    |
|    is_line_search_success | 1        |
|    kl_divergence_loss     | 0.00461  |
|    learning_rate          | 0.0003   |
|    n_updates              | 13       |
|    policy_objective       | 0.0181   |
|    value_loss             | 19.4     |
----------------------------------------
----------------------------------------
| rollout/                  |          |
|    ep_len_mean            | 89.7     |
|    ep_rew_mean            | 89.7     |
| time/                     |          |
|    fps                    | 1273     |
|    iterations             | 15       |
|    time_elapsed           | 24       |
|    total_timesteps        | 30720    |
| train/                    |          |
|    explained_variance     | 0.93     |
|    is_line_search_success | 1        |
|    kl_divergence_loss     | 0.00432  |
|    learning_rate          | 0.0003   |
|    n_updates              | 14       |
|    policy_objective       | 0.0185   |
|    value_loss             | 19.7     |
----------------------------------------
----------------------------------------
| rollout/                  |          |
|    ep_len_mean            | 103      |
|    ep_rew_mean            | 103      |
| time/                     |          |
|    fps                    | 1275     |
|    iterations             | 16       |
|    time_elapsed           | 25       |
|    total_timesteps        | 32768    |
| train/                    |          |
|    explained_variance     | 0.934    |
|    is_line_search_success | 1        |
|    kl_divergence_loss     | 0.00487  |
|    learning_rate          | 0.0003   |
|    n_updates              | 15       |
|    policy_objective       | 0.0145   |
|    value_loss             | 15.6     |
----------------------------------------
----------------------------------------
| rollout/                  |          |
|    ep_len_mean            | 115      |
|    ep_rew_mean            | 115      |
| time/                     |          |
|    fps                    | 1276     |
|    iterations             | 17       |
|    time_elapsed           | 27       |
|    total_timesteps        | 34816    |
| train/                    |          |
|    explained_variance     | 0.939    |
|    is_line_search_success | 1        |
|    kl_divergence_loss     | 0.00642  |
|    learning_rate          | 0.0003   |
|    n_updates              | 16       |
|    policy_objective       | 0.0171   |
|    value_loss             | 17.4     |
----------------------------------------
----------------------------------------
| rollout/                  |          |
|    ep_len_mean            | 133      |
|    ep_rew_mean            | 133      |
| time/                     |          |
|    fps                    | 1278     |
|    iterations             | 18       |
|    time_elapsed           | 28       |
|    total_timesteps        | 36864    |
| train/                    |          |
|    explained_variance     | 0.926    |
|    is_line_search_success | 1        |
|    kl_divergence_loss     | 0.00485  |
|    learning_rate          | 0.0003   |
|    n_updates              | 17       |
|    policy_objective       | 0.016    |
|    value_loss             | 13.4     |
----------------------------------------
----------------------------------------
| rollout/                  |          |
|    ep_len_mean            | 149      |
|    ep_rew_mean            | 149      |
| time/                     |          |
|    fps                    | 1277     |
|    iterations             | 19       |
|    time_elapsed           | 30       |
|    total_timesteps        | 38912    |
| train/                    |          |
|    explained_variance     | 0.963    |
|    is_line_search_success | 1        |
|    kl_divergence_loss     | 0.00843  |
|    learning_rate          | 0.0003   |
|    n_updates              | 18       |
|    policy_objective       | 0.0128   |
|    value_loss             | 8.53     |
----------------------------------------
----------------------------------------
| rollout/                  |          |
|    ep_len_mean            | 166      |
|    ep_rew_mean            | 166      |
| time/                     |          |
|    fps                    | 1276     |
|    iterations             | 20       |
|    time_elapsed           | 32       |
|    total_timesteps        | 40960    |
| train/                    |          |
|    explained_variance     | 0.953    |
|    is_line_search_success | 1        |
|    kl_divergence_loss     | 0.00736  |
|    learning_rate          | 0.0003   |
|    n_updates              | 19       |
|    policy_objective       | 0.017    |
|    value_loss             | 8.09     |
----------------------------------------
----------------------------------------
| rollout/                  |          |
|    ep_len_mean            | 182      |
|    ep_rew_mean            | 182      |
| time/                     |          |
|    fps                    | 1276     |
|    iterations             | 21       |
|    time_elapsed           | 33       |
|    total_timesteps        | 43008    |
| train/                    |          |
|    explained_variance     | 0.989    |
|    is_line_search_success | 1        |
|    kl_divergence_loss     | 0.00745  |
|    learning_rate          | 0.0003   |
|    n_updates              | 20       |
|    policy_objective       | 0.0129   |
|    value_loss             | 2.33     |
----------------------------------------
----------------------------------------
| rollout/                  |          |
|    ep_len_mean            | 198      |
|    ep_rew_mean            | 198      |
| time/                     |          |
|    fps                    | 1276     |
|    iterations             | 22       |
|    time_elapsed           | 35       |
|    total_timesteps        | 45056    |
| train/                    |          |
|    explained_variance     | 0.964    |
|    is_line_search_success | 1        |
|    kl_divergence_loss     | 0.006    |
|    learning_rate          | 0.0003   |
|    n_updates              | 21       |
|    policy_objective       | 0.00939  |
|    value_loss             | 4.83     |
----------------------------------------
----------------------------------------
| rollout/                  |          |
|    ep_len_mean            | 212      |
|    ep_rew_mean            | 212      |
| time/                     |          |
|    fps                    | 1274     |
|    iterations             | 23       |
|    time_elapsed           | 36       |
|    total_timesteps        | 47104    |
| train/                    |          |
|    explained_variance     | 0.971    |
|    is_line_search_success | 1        |
|    kl_divergence_loss     | 0.00534  |
|    learning_rate          | 0.0003   |
|    n_updates              | 22       |
|    policy_objective       | 0.0131   |
|    value_loss             | 6.56     |
----------------------------------------
----------------------------------------
| rollout/                  |          |
|    ep_len_mean            | 229      |
|    ep_rew_mean            | 229      |
| time/                     |          |
|    fps                    | 1273     |
|    iterations             | 24       |
|    time_elapsed           | 38       |
|    total_timesteps        | 49152    |
| train/                    |          |
|    explained_variance     | 0.983    |
|    is_line_search_success | 1        |
|    kl_divergence_loss     | 0.00803  |
|    learning_rate          | 0.0003   |
|    n_updates              | 23       |
|    policy_objective       | 0.022    |
|    value_loss             | 4.84     |
----------------------------------------
----------------------------------------
| rollout/                  |          |
|    ep_len_mean            | 239      |
|    ep_rew_mean            | 239      |
| time/                     |          |
|    fps                    | 1276     |
|    iterations             | 25       |
|    time_elapsed           | 40       |
|    total_timesteps        | 51200    |
| train/                    |          |
|    explained_variance     | 0.96     |
|    is_line_search_success | 1        |
|    kl_divergence_loss     | 0.00368  |
|    learning_rate          | 0.0003   |
|    n_updates              | 24       |
|    policy_objective       | 0.01     |
|    value_loss             | 6.96     |
----------------------------------------
----------------------------------------
| rollout/                  |          |
|    ep_len_mean            | 254      |
|    ep_rew_mean            | 254      |
| time/                     |          |
|    fps                    | 1274     |
|    iterations             | 26       |
|    time_elapsed           | 41       |
|    total_timesteps        | 53248    |
| train/                    |          |
|    explained_variance     | 0.89     |
|    is_line_search_success | 1        |
|    kl_divergence_loss     | 0.00929  |
|    learning_rate          | 0.0003   |
|    n_updates              | 25       |
|    policy_objective       | 0.0154   |
|    value_loss             | 7.53     |
----------------------------------------
----------------------------------------
| rollout/                  |          |
|    ep_len_mean            | 265      |
|    ep_rew_mean            | 265      |
| time/                     |          |
|    fps                    | 1277     |
|    iterations             | 27       |
|    time_elapsed           | 43       |
|    total_timesteps        | 55296    |
| train/                    |          |
|    explained_variance     | 0.931    |
|    is_line_search_success | 1        |
|    kl_divergence_loss     | 0.0046   |
|    learning_rate          | 0.0003   |
|    n_updates              | 26       |
|    policy_objective       | 0.00567  |
|    value_loss             | 11.3     |
----------------------------------------
----------------------------------------
| rollout/                  |          |
|    ep_len_mean            | 278      |
|    ep_rew_mean            | 278      |
| time/                     |          |
|    fps                    | 1277     |
|    iterations             | 28       |
|    time_elapsed           | 44       |
|    total_timesteps        | 57344    |
| train/                    |          |
|    explained_variance     | 0.929    |
|    is_line_search_success | 1        |
|    kl_divergence_loss     | 0.00624  |
|    learning_rate          | 0.0003   |
|    n_updates              | 27       |
|    policy_objective       | 0.0133   |
|    value_loss             | 6.88     |
----------------------------------------
----------------------------------------
| rollout/                  |          |
|    ep_len_mean            | 288      |
|    ep_rew_mean            | 288      |
| time/                     |          |
|    fps                    | 1278     |
|    iterations             | 29       |
|    time_elapsed           | 46       |
|    total_timesteps        | 59392    |
| train/                    |          |
|    explained_variance     | 0.953    |
|    is_line_search_success | 1        |
|    kl_divergence_loss     | 0.00599  |
|    learning_rate          | 0.0003   |
|    n_updates              | 28       |
|    policy_objective       | 0.00933  |
|    value_loss             | 11.4     |
----------------------------------------
----------------------------------------
| rollout/                  |          |
|    ep_len_mean            | 302      |
|    ep_rew_mean            | 302      |
| time/                     |          |
|    fps                    | 1278     |
|    iterations             | 30       |
|    time_elapsed           | 48       |
|    total_timesteps        | 61440    |
| train/                    |          |
|    explained_variance     | 0.938    |
|    is_line_search_success | 1        |
|    kl_divergence_loss     | 0.00613  |
|    learning_rate          | 0.0003   |
|    n_updates              | 29       |
|    policy_objective       | 0.0109   |
|    value_loss             | 6.15     |
----------------------------------------
----------------------------------------
| rollout/                  |          |
|    ep_len_mean            | 309      |
|    ep_rew_mean            | 309      |
| time/                     |          |
|    fps                    | 1277     |
|    iterations             | 31       |
|    time_elapsed           | 49       |
|    total_timesteps        | 63488    |
| train/                    |          |
|    explained_variance     | 0.946    |
|    is_line_search_success | 1        |
|    kl_divergence_loss     | 0.00521  |
|    learning_rate          | 0.0003   |
|    n_updates              | 30       |
|    policy_objective       | 0.00648  |
|    value_loss             | 15.2     |
----------------------------------------
----------------------------------------
| rollout/                  |          |
|    ep_len_mean            | 323      |
|    ep_rew_mean            | 323      |
| time/                     |          |
|    fps                    | 1276     |
|    iterations             | 32       |
|    time_elapsed           | 51       |
|    total_timesteps        | 65536    |
| train/                    |          |
|    explained_variance     | 0.949    |
|    is_line_search_success | 1        |
|    kl_divergence_loss     | 0.00653  |
|    learning_rate          | 0.0003   |
|    n_updates              | 31       |
|    policy_objective       | 0.0105   |
|    value_loss             | 10.1     |
----------------------------------------
----------------------------------------
| rollout/                  |          |
|    ep_len_mean            | 333      |
|    ep_rew_mean            | 333      |
| time/                     |          |
|    fps                    | 1276     |
|    iterations             | 33       |
|    time_elapsed           | 52       |
|    total_timesteps        | 67584    |
| train/                    |          |
|    explained_variance     | 0.881    |
|    is_line_search_success | 1        |
|    kl_divergence_loss     | 0.00634  |
|    learning_rate          | 0.0003   |
|    n_updates              | 32       |
|    policy_objective       | 0.00806  |
|    value_loss             | 1.72     |
----------------------------------------
----------------------------------------
| rollout/                  |          |
|    ep_len_mean            | 343      |
|    ep_rew_mean            | 343      |
| time/                     |          |
|    fps                    | 1276     |
|    iterations             | 34       |
|    time_elapsed           | 54       |
|    total_timesteps        | 69632    |
| train/                    |          |
|    explained_variance     | 0.955    |
|    is_line_search_success | 1        |
|    kl_divergence_loss     | 0.00737  |
|    learning_rate          | 0.0003   |
|    n_updates              | 33       |
|    policy_objective       | 0.00814  |
|    value_loss             | 1.48     |
----------------------------------------
----------------------------------------
| rollout/                  |          |
|    ep_len_mean            | 353      |
|    ep_rew_mean            | 353      |
| time/                     |          |
|    fps                    | 1277     |
|    iterations             | 35       |
|    time_elapsed           | 56       |
|    total_timesteps        | 71680    |
| train/                    |          |
|    explained_variance     | 0.928    |
|    is_line_search_success | 1        |
|    kl_divergence_loss     | 0.00746  |
|    learning_rate          | 0.0003   |
|    n_updates              | 34       |
|    policy_objective       | 0.00749  |
|    value_loss             | 0.352    |
----------------------------------------
----------------------------------------
| rollout/                  |          |
|    ep_len_mean            | 358      |
|    ep_rew_mean            | 358      |
| time/                     |          |
|    fps                    | 1277     |
|    iterations             | 36       |
|    time_elapsed           | 57       |
|    total_timesteps        | 73728    |
| train/                    |          |
|    explained_variance     | 0.951    |
|    is_line_search_success | 1        |
|    kl_divergence_loss     | 0.00998  |
|    learning_rate          | 0.0003   |
|    n_updates              | 35       |
|    policy_objective       | 0.0179   |
|    value_loss             | 0.25     |
----------------------------------------
----------------------------------------
| rollout/                  |          |
|    ep_len_mean            | 365      |
|    ep_rew_mean            | 365      |
| time/                     |          |
|    fps                    | 1277     |
|    iterations             | 37       |
|    time_elapsed           | 59       |
|    total_timesteps        | 75776    |
| train/                    |          |
|    explained_variance     | 0.908    |
|    is_line_search_success | 1        |
|    kl_divergence_loss     | 0.00552  |
|    learning_rate          | 0.0003   |
|    n_updates              | 36       |
|    policy_objective       | 0.0055   |
|    value_loss             | 0.162    |
----------------------------------------
----------------------------------------
| rollout/                  |          |
|    ep_len_mean            | 372      |
|    ep_rew_mean            | 372      |
| time/                     |          |
|    fps                    | 1278     |
|    iterations             | 38       |
|    time_elapsed           | 60       |
|    total_timesteps        | 77824    |
| train/                    |          |
|    explained_variance     | 0.84     |
|    is_line_search_success | 1        |
|    kl_divergence_loss     | 0.00949  |
|    learning_rate          | 0.0003   |
|    n_updates              | 37       |
|    policy_objective       | 0.0167   |
|    value_loss             | 0.233    |
----------------------------------------
----------------------------------------
| rollout/                  |          |
|    ep_len_mean            | 376      |
|    ep_rew_mean            | 376      |
| time/                     |          |
|    fps                    | 1278     |
|    iterations             | 39       |
|    time_elapsed           | 62       |
|    total_timesteps        | 79872    |
| train/                    |          |
|    explained_variance     | 0.079    |
|    is_line_search_success | 1        |
|    kl_divergence_loss     | 0.00811  |
|    learning_rate          | 0.0003   |
|    n_updates              | 38       |
|    policy_objective       | 0.00597  |
|    value_loss             | 0.0633   |
----------------------------------------
----------------------------------------
| rollout/                  |          |
|    ep_len_mean            | 381      |
|    ep_rew_mean            | 381      |
| time/                     |          |
|    fps                    | 1279     |
|    iterations             | 40       |
|    time_elapsed           | 64       |
|    total_timesteps        | 81920    |
| train/                    |          |
|    explained_variance     | 0.544    |
|    is_line_search_success | 1        |
|    kl_divergence_loss     | 0.00978  |
|    learning_rate          | 0.0003   |
|    n_updates              | 39       |
|    policy_objective       | 0.00944  |
|    value_loss             | 0.0936   |
----------------------------------------
----------------------------------------
| rollout/                  |          |
|    ep_len_mean            | 390      |
|    ep_rew_mean            | 390      |
| time/                     |          |
|    fps                    | 1281     |
|    iterations             | 41       |
|    time_elapsed           | 65       |
|    total_timesteps        | 83968    |
| train/                    |          |
|    explained_variance     | 0.202    |
|    is_line_search_success | 1        |
|    kl_divergence_loss     | 0.00675  |
|    learning_rate          | 0.0003   |
|    n_updates              | 40       |
|    policy_objective       | 0.00538  |
|    value_loss             | 0.0735   |
----------------------------------------
----------------------------------------
| rollout/                  |          |
|    ep_len_mean            | 394      |
|    ep_rew_mean            | 394      |
| time/                     |          |
|    fps                    | 1282     |
|    iterations             | 42       |
|    time_elapsed           | 67       |
|    total_timesteps        | 86016    |
| train/                    |          |
|    explained_variance     | -1.66    |
|    is_line_search_success | 1        |
|    kl_divergence_loss     | 0.00815  |
|    learning_rate          | 0.0003   |
|    n_updates              | 41       |
|    policy_objective       | 0.00569  |
|    value_loss             | 0.381    |
----------------------------------------
----------------------------------------
| rollout/                  |          |
|    ep_len_mean            | 399      |
|    ep_rew_mean            | 399      |
| time/                     |          |
|    fps                    | 1280     |
|    iterations             | 43       |
|    time_elapsed           | 68       |
|    total_timesteps        | 88064    |
| train/                    |          |
|    explained_variance     | 0.399    |
|    is_line_search_success | 1        |
|    kl_divergence_loss     | 0.0094   |
|    learning_rate          | 0.0003   |
|    n_updates              | 42       |
|    policy_objective       | 0.0123   |
|    value_loss             | 0.06     |
----------------------------------------
----------------------------------------
| rollout/                  |          |
|    ep_len_mean            | 402      |
|    ep_rew_mean            | 402      |
| time/                     |          |
|    fps                    | 1280     |
|    iterations             | 44       |
|    time_elapsed           | 70       |
|    total_timesteps        | 90112    |
| train/                    |          |
|    explained_variance     | 0.653    |
|    is_line_search_success | 1        |
|    kl_divergence_loss     | 0.00911  |
|    learning_rate          | 0.0003   |
|    n_updates              | 43       |
|    policy_objective       | 0.00579  |
|    value_loss             | 0.0126   |
----------------------------------------
----------------------------------------
| rollout/                  |          |
|    ep_len_mean            | 414      |
|    ep_rew_mean            | 414      |
| time/                     |          |
|    fps                    | 1280     |
|    iterations             | 45       |
|    time_elapsed           | 71       |
|    total_timesteps        | 92160    |
| train/                    |          |
|    explained_variance     | 0.243    |
|    is_line_search_success | 1        |
|    kl_divergence_loss     | 0.00874  |
|    learning_rate          | 0.0003   |
|    n_updates              | 44       |
|    policy_objective       | 0.00711  |
|    value_loss             | 0.0101   |
----------------------------------------
----------------------------------------
| rollout/                  |          |
|    ep_len_mean            | 425      |
|    ep_rew_mean            | 425      |
| time/                     |          |
|    fps                    | 1280     |
|    iterations             | 46       |
|    time_elapsed           | 73       |
|    total_timesteps        | 94208    |
| train/                    |          |
|    explained_variance     | 0.716    |
|    is_line_search_success | 1        |
|    kl_divergence_loss     | 0.00592  |
|    learning_rate          | 0.0003   |
|    n_updates              | 45       |
|    policy_objective       | 0.00403  |
|    value_loss             | 0.0116   |
----------------------------------------
----------------------------------------
| rollout/                  |          |
|    ep_len_mean            | 437      |
|    ep_rew_mean            | 437      |
| time/                     |          |
|    fps                    | 1279     |
|    iterations             | 47       |
|    time_elapsed           | 75       |
|    total_timesteps        | 96256    |
| train/                    |          |
|    explained_variance     | 0.765    |
|    is_line_search_success | 1        |
|    kl_divergence_loss     | 0.00681  |
|    learning_rate          | 0.0003   |
|    n_updates              | 46       |
|    policy_objective       | 0.0104   |
|    value_loss             | 0.00419  |
----------------------------------------
----------------------------------------
| rollout/                  |          |
|    ep_len_mean            | 446      |
|    ep_rew_mean            | 446      |
| time/                     |          |
|    fps                    | 1279     |
|    iterations             | 48       |
|    time_elapsed           | 76       |
|    total_timesteps        | 98304    |
| train/                    |          |
|    explained_variance     | 0.565    |
|    is_line_search_success | 1        |
|    kl_divergence_loss     | 0.00724  |
|    learning_rate          | 0.0003   |
|    n_updates              | 47       |
|    policy_objective       | 0.00555  |
|    value_loss             | 0.00454  |
----------------------------------------
----------------------------------------
| rollout/                  |          |
|    ep_len_mean            | 451      |
|    ep_rew_mean            | 451      |
| time/                     |          |
|    fps                    | 1278     |
|    iterations             | 49       |
|    time_elapsed           | 78       |
|    total_timesteps        | 100352   |
| train/                    |          |
|    explained_variance     | 0.0572   |
|    is_line_search_success | 1        |
|    kl_divergence_loss     | 0.00363  |
|    learning_rate          | 0.0003   |
|    n_updates              | 48       |
|    policy_objective       | 0.00723  |
|    value_loss             | 0.00133  |
----------------------------------------
wandb: WARNING Symlinked 1 file into the W&B run directory; call wandb.save again to sync new files.
wandb: updating run metadata
wandb: uploading model.zip; uploading output.log; uploading wandb-summary.json
wandb: uploading model.zip; uploading output.log; uploading config.yaml; uploading logs/CartPole_masscart_random_walk_Baseline_20251217_125255_0/events.out.tfevents.1765951146.hungchan-Precision-7560.41849.0
wandb: uploading history steps 381-434, summary, console lines 828-882
wandb: 
wandb: Run history:
wandb:                  global_step ▁▁▁▁▁▂▂▂▂▂▂▂▂▂▃▃▃▃▃▄▄▄▄▄▅▅▅▅▅▅▆▆▆▆▆▇████
wandb:          rollout/ep_len_mean ▁▁▁▁▂▂▂▂▂▂▂▂▂▃▃▃▄▄▄▄▅▅▅▅▆▆▆▆▆▇▇▇▇▇▇▇▇███
wandb:          rollout/ep_rew_mean ▁▁▁▁▂▂▂▂▂▂▂▂▂▂▃▃▄▄▄▄▅▅▅▅▆▆▆▆▆▇▇▇▇▇▇▇▇███
wandb:                     time/fps █▃▂▂▃▄▄▃▂▂▁▁▂▂▂▂▂▂▁▁▁▂▂▂▂▂▂▂▂▂▂▂▂▂▂▂▂▂▂▂
wandb:     train/explained_variance ▅▆▆▆▇▇▇████████████████████████▆▇▆▁▇▆▇▇▆
wandb: train/is_line_search_success ▁▁▁▁▁▁▁▁▁▁▁▁▁▁▁▁▁▁▁▁▁▁▁▁▁▁▁▁▁▁▁▁▁▁▁▁▁▁▁▁
wandb:     train/kl_divergence_loss ▇▆▅▅▅▅▄▄▃▃▂▂▂▄▂▅▅▄▃▆▇▂▄▄▄▄▄▅▅█▇▆█▄▆▇▇▄▅▁
wandb:          train/learning_rate ▁▁▁▁▁▁▁▁▁▁▁▁▁▁▁▁▁▁▁▁▁▁▁▁▁▁▁▁▁▁▁▁▁▁▁▁▁▁▁▁
wandb:       train/policy_objective ▅▇▄▄█▇▄▅▆▅▆▆▅▆▅▆▄▃▄▇▅▂▄▃▃▃▂▂▂▆▆▂▃▁▂▂▂▁▃▂
wandb:             train/value_loss ▆▄▆▄▇█▄▃▃▃▃▃▃▃▂▂▁▁▂▁▂▂▂▂▂▂▁▁▁▁▁▁▁▁▁▁▁▁▁▁
wandb: 
wandb: Run summary:
wandb:                  global_step 100352
wandb:          rollout/ep_len_mean 450.54
wandb:          rollout/ep_rew_mean 450.54
wandb:                     time/fps 1278
wandb:     train/explained_variance 0.05716
wandb: train/is_line_search_success 1
wandb:     train/kl_divergence_loss 0.00363
wandb:          train/learning_rate 0.0003
wandb:       train/policy_objective 0.00723
wandb:             train/value_loss 0.00133
wandb: 
wandb: 🚀 View run CartPole_masscart_random_walk_Baseline_20251217_125255 at: https://wandb.ai/hungtrab-hanoi-university-of-science-and-technology/CartPole_Drift_Research_TRPO/runs/zpqkcftt
wandb: ⭐️ View project at: https://wandb.ai/hungtrab-hanoi-university-of-science-and-technology/CartPole_Drift_Research_TRPO
wandb: Synced 6 W&B file(s), 0 media file(s), 0 artifact file(s) and 2 other file(s)
wandb: Find logs at: logs/CartPole_masscart_random_walk_Baseline_20251217_125255/wandb/run-20251217_125904-zpqkcftt/logs
Model saved locally to: models/CartPole_masscart_random_walk_Baseline_20251217_125255.zip
