wandb: Currently logged in as: hungtrab (hungtrab-hanoi-university-of-science-and-technology) to https://api.wandb.ai. Use `wandb login --relogin` to force relogin
wandb: setting up run gsqu89am
wandb: Tracking run with wandb version 0.23.1
wandb: Run data is saved locally in logs/CartPole_gravity_jump_Adaptive_20251216_224147/wandb/run-20251216_224336-gsqu89am
wandb: Run `wandb offline` to turn off syncing.
wandb: Syncing run CartPole_gravity_jump_Adaptive_20251216_224147
wandb: ⭐️ View project at https://wandb.ai/hungtrab-hanoi-university-of-science-and-technology/CartPole_Drift_Research
wandb: 🚀 View run at https://wandb.ai/hungtrab-hanoi-university-of-science-and-technology/CartPole_Drift_Research/runs/gsqu89am
Warning: sb3-contrib not installed. TRPO unavailable. Install with: pip install sb3-contrib
--- Training Start: CartPole_gravity_jump_Adaptive_20251216_224147 ---
>>> [Wrapper] Initialized Non-Stationary CartPole
    - gravity: jump (magnitude=10.0, period=50000)
>>> Initializing PPO with kwargs: ['policy', 'env', 'learning_rate', 'gamma', 'verbose', 'tensorboard_log', 'n_steps', 'batch_size']
Using cuda device
Wrapping the env in a DummyVecEnv.
Logging to logs/CartPole_gravity_jump_Adaptive_20251216_224147_0
>>> [DriftAdaptiveCallback] Training Started
    Algorithm: PPO
    Target Param: gravity (base=9.8)
    Scale Factor: 0.1
    
    Adaptive Hyperparameters:
      - Learning Rate: 0.000300
      - Clip Range: 0.200 (adapt=True)
      - Entropy Coef: 0.0000 (adapt=True)
-----------------------------------
| adaptive/            |          |
|    adaptation_factor | 1        |
|    algorithm         | PPO      |
|    base_clip_range   | 0.2      |
|    base_lr           | 0.0003   |
|    clip_range        | 0.2      |
|    drift_magnitude   | 0        |
|    ent_coef          | 0        |
|    learning_rate     | 0.0003   |
| env/                 |          |
|    base_value        | 9.8      |
|    gravity           | 9.8      |
| rollout/             |          |
|    ep_len_mean       | 21.5     |
|    ep_rew_mean       | 21.5     |
| time/                |          |
|    fps               | 1194     |
|    iterations        | 1        |
|    time_elapsed      | 1        |
|    total_timesteps   | 2048     |
-----------------------------------
------------------------------------------
| adaptive/               |              |
|    adaptation_factor    | 1            |
|    algorithm            | PPO          |
|    base_clip_range      | 0.2          |
|    base_lr              | 0.0003       |
|    clip_range           | 0.2          |
|    drift_magnitude      | 0            |
|    ent_coef             | 0            |
|    learning_rate        | 0.0003       |
| env/                    |              |
|    base_value           | 9.8          |
|    gravity              | 9.8          |
| rollout/                |              |
|    ep_len_mean          | 25.4         |
|    ep_rew_mean          | 25.4         |
| time/                   |              |
|    fps                  | 1041         |
|    iterations           | 2            |
|    time_elapsed         | 3            |
|    total_timesteps      | 4096         |
| train/                  |              |
|    approx_kl            | 0.009455091  |
|    clip_fraction        | 0.116        |
|    clip_range           | 0.2          |
|    entropy_loss         | -0.685       |
|    explained_variance   | 0.0019194484 |
|    learning_rate        | 0.0003       |
|    loss                 | 6.84         |
|    n_updates            | 10           |
|    policy_gradient_loss | -0.0179      |
|    value_loss           | 51.1         |
------------------------------------------
-----------------------------------------
| adaptive/               |             |
|    adaptation_factor    | 1           |
|    algorithm            | PPO         |
|    base_clip_range      | 0.2         |
|    base_lr              | 0.0003      |
|    clip_range           | 0.2         |
|    drift_magnitude      | 0           |
|    ent_coef             | 0           |
|    learning_rate        | 0.0003      |
| env/                    |             |
|    base_value           | 9.8         |
|    gravity              | 9.8         |
| rollout/                |             |
|    ep_len_mean          | 35.6        |
|    ep_rew_mean          | 35.6        |
| time/                   |             |
|    fps                  | 997         |
|    iterations           | 3           |
|    time_elapsed         | 6           |
|    total_timesteps      | 6144        |
| train/                  |             |
|    approx_kl            | 0.012247732 |
|    clip_fraction        | 0.0883      |
|    clip_range           | 0.2         |
|    entropy_loss         | -0.663      |
|    explained_variance   | 0.093123734 |
|    learning_rate        | 0.0003      |
|    loss                 | 11.4        |
|    n_updates            | 20          |
|    policy_gradient_loss | -0.0206     |
|    value_loss           | 33.4        |
-----------------------------------------
------------------------------------------
| adaptive/               |              |
|    adaptation_factor    | 1            |
|    algorithm            | PPO          |
|    base_clip_range      | 0.2          |
|    base_lr              | 0.0003       |
|    clip_range           | 0.2          |
|    drift_magnitude      | 0            |
|    ent_coef             | 0            |
|    learning_rate        | 0.0003       |
| env/                    |              |
|    base_value           | 9.8          |
|    gravity              | 9.8          |
| rollout/                |              |
|    ep_len_mean          | 49.2         |
|    ep_rew_mean          | 49.2         |
| time/                   |              |
|    fps                  | 991          |
|    iterations           | 4            |
|    time_elapsed         | 8            |
|    total_timesteps      | 8192         |
| train/                  |              |
|    approx_kl            | 0.0074620023 |
|    clip_fraction        | 0.087        |
|    clip_range           | 0.2          |
|    entropy_loss         | -0.632       |
|    explained_variance   | 0.24673635   |
|    learning_rate        | 0.0003       |
|    loss                 | 21.7         |
|    n_updates            | 30           |
|    policy_gradient_loss | -0.0152      |
|    value_loss           | 56.7         |
------------------------------------------
-----------------------------------------
| adaptive/               |             |
|    adaptation_factor    | 1           |
|    algorithm            | PPO         |
|    base_clip_range      | 0.2         |
|    base_lr              | 0.0003      |
|    clip_range           | 0.2         |
|    drift_magnitude      | 0           |
|    ent_coef             | 0           |
|    learning_rate        | 0.0003      |
| env/                    |             |
|    base_value           | 9.8         |
|    gravity              | 9.8         |
| rollout/                |             |
|    ep_len_mean          | 65          |
|    ep_rew_mean          | 65          |
| time/                   |             |
|    fps                  | 989         |
|    iterations           | 5           |
|    time_elapsed         | 10          |
|    total_timesteps      | 10240       |
| train/                  |             |
|    approx_kl            | 0.006662513 |
|    clip_fraction        | 0.0497      |
|    clip_range           | 0.2         |
|    entropy_loss         | -0.608      |
|    explained_variance   | 0.25501412  |
|    learning_rate        | 0.0003      |
|    loss                 | 24.8        |
|    n_updates            | 40          |
|    policy_gradient_loss | -0.0164     |
|    value_loss           | 63          |
-----------------------------------------
-----------------------------------------
| adaptive/               |             |
|    adaptation_factor    | 1           |
|    algorithm            | PPO         |
|    base_clip_range      | 0.2         |
|    base_lr              | 0.0003      |
|    clip_range           | 0.2         |
|    drift_magnitude      | 0           |
|    ent_coef             | 0           |
|    learning_rate        | 0.0003      |
| env/                    |             |
|    base_value           | 9.8         |
|    gravity              | 9.8         |
| rollout/                |             |
|    ep_len_mean          | 80.2        |
|    ep_rew_mean          | 80.2        |
| time/                   |             |
|    fps                  | 987         |
|    iterations           | 6           |
|    time_elapsed         | 12          |
|    total_timesteps      | 12288       |
| train/                  |             |
|    approx_kl            | 0.006666332 |
|    clip_fraction        | 0.07        |
|    clip_range           | 0.2         |
|    entropy_loss         | -0.601      |
|    explained_variance   | 0.490485    |
|    learning_rate        | 0.0003      |
|    loss                 | 11.6        |
|    n_updates            | 50          |
|    policy_gradient_loss | -0.0154     |
|    value_loss           | 49.1        |
-----------------------------------------
-----------------------------------------
| adaptive/               |             |
|    adaptation_factor    | 1           |
|    algorithm            | PPO         |
|    base_clip_range      | 0.2         |
|    base_lr              | 0.0003      |
|    clip_range           | 0.2         |
|    drift_magnitude      | 0           |
|    ent_coef             | 0           |
|    learning_rate        | 0.0003      |
| env/                    |             |
|    base_value           | 9.8         |
|    gravity              | 9.8         |
| rollout/                |             |
|    ep_len_mean          | 95.6        |
|    ep_rew_mean          | 95.6        |
| time/                   |             |
|    fps                  | 980         |
|    iterations           | 7           |
|    time_elapsed         | 14          |
|    total_timesteps      | 14336       |
| train/                  |             |
|    approx_kl            | 0.008849204 |
|    clip_fraction        | 0.103       |
|    clip_range           | 0.2         |
|    entropy_loss         | -0.593      |
|    explained_variance   | 0.7351588   |
|    learning_rate        | 0.0003      |
|    loss                 | 22.4        |
|    n_updates            | 60          |
|    policy_gradient_loss | -0.0132     |
|    value_loss           | 46.6        |
-----------------------------------------
-----------------------------------------
| adaptive/               |             |
|    adaptation_factor    | 1           |
|    algorithm            | PPO         |
|    base_clip_range      | 0.2         |
|    base_lr              | 0.0003      |
|    clip_range           | 0.2         |
|    drift_magnitude      | 0           |
|    ent_coef             | 0           |
|    learning_rate        | 0.0003      |
| env/                    |             |
|    base_value           | 9.8         |
|    gravity              | 9.8         |
| rollout/                |             |
|    ep_len_mean          | 111         |
|    ep_rew_mean          | 111         |
| time/                   |             |
|    fps                  | 980         |
|    iterations           | 8           |
|    time_elapsed         | 16          |
|    total_timesteps      | 16384       |
| train/                  |             |
|    approx_kl            | 0.008039488 |
|    clip_fraction        | 0.0918      |
|    clip_range           | 0.2         |
|    entropy_loss         | -0.581      |
|    explained_variance   | 0.60873395  |
|    learning_rate        | 0.0003      |
|    loss                 | 29.9        |
|    n_updates            | 70          |
|    policy_gradient_loss | -0.013      |
|    value_loss           | 56.1        |
-----------------------------------------
-----------------------------------------
| adaptive/               |             |
|    adaptation_factor    | 1           |
|    algorithm            | PPO         |
|    base_clip_range      | 0.2         |
|    base_lr              | 0.0003      |
|    clip_range           | 0.2         |
|    drift_magnitude      | 0           |
|    ent_coef             | 0           |
|    learning_rate        | 0.0003      |
| env/                    |             |
|    base_value           | 9.8         |
|    gravity              | 9.8         |
| rollout/                |             |
|    ep_len_mean          | 131         |
|    ep_rew_mean          | 131         |
| time/                   |             |
|    fps                  | 976         |
|    iterations           | 9           |
|    time_elapsed         | 18          |
|    total_timesteps      | 18432       |
| train/                  |             |
|    approx_kl            | 0.005698641 |
|    clip_fraction        | 0.0495      |
|    clip_range           | 0.2         |
|    entropy_loss         | -0.55       |
|    explained_variance   | 0.4317522   |
|    learning_rate        | 0.0003      |
|    loss                 | 18.8        |
|    n_updates            | 80          |
|    policy_gradient_loss | -0.00819    |
|    value_loss           | 66.8        |
-----------------------------------------
-----------------------------------------
| adaptive/               |             |
|    adaptation_factor    | 1           |
|    algorithm            | PPO         |
|    base_clip_range      | 0.2         |
|    base_lr              | 0.0003      |
|    clip_range           | 0.2         |
|    drift_magnitude      | 0           |
|    ent_coef             | 0           |
|    learning_rate        | 0.0003      |
| env/                    |             |
|    base_value           | 9.8         |
|    gravity              | 9.8         |
| rollout/                |             |
|    ep_len_mean          | 147         |
|    ep_rew_mean          | 147         |
| time/                   |             |
|    fps                  | 974         |
|    iterations           | 10          |
|    time_elapsed         | 21          |
|    total_timesteps      | 20480       |
| train/                  |             |
|    approx_kl            | 0.004227045 |
|    clip_fraction        | 0.0367      |
|    clip_range           | 0.2         |
|    entropy_loss         | -0.553      |
|    explained_variance   | 0.6898747   |
|    learning_rate        | 0.0003      |
|    loss                 | 8.76        |
|    n_updates            | 90          |
|    policy_gradient_loss | -0.00525    |
|    value_loss           | 35.9        |
-----------------------------------------
-----------------------------------------
| adaptive/               |             |
|    adaptation_factor    | 1           |
|    algorithm            | PPO         |
|    base_clip_range      | 0.2         |
|    base_lr              | 0.0003      |
|    clip_range           | 0.2         |
|    drift_magnitude      | 0           |
|    ent_coef             | 0           |
|    learning_rate        | 0.0003      |
| env/                    |             |
|    base_value           | 9.8         |
|    gravity              | 9.8         |
| rollout/                |             |
|    ep_len_mean          | 166         |
|    ep_rew_mean          | 166         |
| time/                   |             |
|    fps                  | 977         |
|    iterations           | 11          |
|    time_elapsed         | 23          |
|    total_timesteps      | 22528       |
| train/                  |             |
|    approx_kl            | 0.011519985 |
|    clip_fraction        | 0.164       |
|    clip_range           | 0.2         |
|    entropy_loss         | -0.553      |
|    explained_variance   | 0.9246035   |
|    learning_rate        | 0.0003      |
|    loss                 | 5.75        |
|    n_updates            | 100         |
|    policy_gradient_loss | -0.018      |
|    value_loss           | 18.2        |
-----------------------------------------
------------------------------------------
| adaptive/               |              |
|    adaptation_factor    | 1            |
|    algorithm            | PPO          |
|    base_clip_range      | 0.2          |
|    base_lr              | 0.0003       |
|    clip_range           | 0.2          |
|    drift_magnitude      | 0            |
|    ent_coef             | 0            |
|    learning_rate        | 0.0003       |
| env/                    |              |
|    base_value           | 9.8          |
|    gravity              | 9.8          |
| rollout/                |              |
|    ep_len_mean          | 184          |
|    ep_rew_mean          | 184          |
| time/                   |              |
|    fps                  | 982          |
|    iterations           | 12           |
|    time_elapsed         | 25           |
|    total_timesteps      | 24576        |
| train/                  |              |
|    approx_kl            | 0.0075173164 |
|    clip_fraction        | 0.127        |
|    clip_range           | 0.2          |
|    entropy_loss         | -0.528       |
|    explained_variance   | 0.8666077    |
|    learning_rate        | 0.0003       |
|    loss                 | 0.659        |
|    n_updates            | 110          |
|    policy_gradient_loss | -0.014       |
|    value_loss           | 7.84         |
------------------------------------------
-----------------------------------------
| adaptive/               |             |
|    adaptation_factor    | 1           |
|    algorithm            | PPO         |
|    base_clip_range      | 0.2         |
|    base_lr              | 0.0003      |
|    clip_range           | 0.2         |
|    drift_magnitude      | 0           |
|    ent_coef             | 0           |
|    learning_rate        | 0.0003      |
| env/                    |             |
|    base_value           | 9.8         |
|    gravity              | 9.8         |
| rollout/                |             |
|    ep_len_mean          | 202         |
|    ep_rew_mean          | 202         |
| time/                   |             |
|    fps                  | 981         |
|    iterations           | 13          |
|    time_elapsed         | 27          |
|    total_timesteps      | 26624       |
| train/                  |             |
|    approx_kl            | 0.006671251 |
|    clip_fraction        | 0.0668      |
|    clip_range           | 0.2         |
|    entropy_loss         | -0.513      |
|    explained_variance   | 0.10242087  |
|    learning_rate        | 0.0003      |
|    loss                 | 0.099       |
|    n_updates            | 120         |
|    policy_gradient_loss | -0.00435    |
|    value_loss           | 4.59        |
-----------------------------------------
------------------------------------------
| adaptive/               |              |
|    adaptation_factor    | 1            |
|    algorithm            | PPO          |
|    base_clip_range      | 0.2          |
|    base_lr              | 0.0003       |
|    clip_range           | 0.2          |
|    drift_magnitude      | 0            |
|    ent_coef             | 0            |
|    learning_rate        | 0.0003       |
| env/                    |              |
|    base_value           | 9.8          |
|    gravity              | 9.8          |
| rollout/                |              |
|    ep_len_mean          | 218          |
|    ep_rew_mean          | 218          |
| time/                   |              |
|    fps                  | 980          |
|    iterations           | 14           |
|    time_elapsed         | 29           |
|    total_timesteps      | 28672        |
| train/                  |              |
|    approx_kl            | 0.0048895394 |
|    clip_fraction        | 0.0316       |
|    clip_range           | 0.2          |
|    entropy_loss         | -0.514       |
|    explained_variance   | 0.058446825  |
|    learning_rate        | 0.0003       |
|    loss                 | 0.0502       |
|    n_updates            | 130          |
|    policy_gradient_loss | -0.00219     |
|    value_loss           | 2.97         |
------------------------------------------
------------------------------------------
| adaptive/               |              |
|    adaptation_factor    | 1            |
|    algorithm            | PPO          |
|    base_clip_range      | 0.2          |
|    base_lr              | 0.0003       |
|    clip_range           | 0.2          |
|    drift_magnitude      | 0            |
|    ent_coef             | 0            |
|    learning_rate        | 0.0003       |
| env/                    |              |
|    base_value           | 9.8          |
|    gravity              | 9.8          |
| rollout/                |              |
|    ep_len_mean          | 239          |
|    ep_rew_mean          | 239          |
| time/                   |              |
|    fps                  | 978          |
|    iterations           | 15           |
|    time_elapsed         | 31           |
|    total_timesteps      | 30720        |
| train/                  |              |
|    approx_kl            | 0.00331544   |
|    clip_fraction        | 0.0267       |
|    clip_range           | 0.2          |
|    entropy_loss         | -0.503       |
|    explained_variance   | 0.0018808246 |
|    learning_rate        | 0.0003       |
|    loss                 | 0.07         |
|    n_updates            | 140          |
|    policy_gradient_loss | -0.00103     |
|    value_loss           | 2.03         |
------------------------------------------
------------------------------------------
| adaptive/               |              |
|    adaptation_factor    | 1            |
|    algorithm            | PPO          |
|    base_clip_range      | 0.2          |
|    base_lr              | 0.0003       |
|    clip_range           | 0.2          |
|    drift_magnitude      | 0            |
|    ent_coef             | 0            |
|    learning_rate        | 0.0003       |
| env/                    |              |
|    base_value           | 9.8          |
|    gravity              | 9.8          |
| rollout/                |              |
|    ep_len_mean          | 254          |
|    ep_rew_mean          | 254          |
| time/                   |              |
|    fps                  | 980          |
|    iterations           | 16           |
|    time_elapsed         | 33           |
|    total_timesteps      | 32768        |
| train/                  |              |
|    approx_kl            | 0.0035822727 |
|    clip_fraction        | 0.0314       |
|    clip_range           | 0.2          |
|    entropy_loss         | -0.499       |
|    explained_variance   | -0.06925738  |
|    learning_rate        | 0.0003       |
|    loss                 | 0.0788       |
|    n_updates            | 150          |
|    policy_gradient_loss | -0.00081     |
|    value_loss           | 1.24         |
------------------------------------------
-------------------------------------------
| adaptive/               |               |
|    adaptation_factor    | 1             |
|    algorithm            | PPO           |
|    base_clip_range      | 0.2           |
|    base_lr              | 0.0003        |
|    clip_range           | 0.2           |
|    drift_magnitude      | 0             |
|    ent_coef             | 0             |
|    learning_rate        | 0.0003        |
| env/                    |               |
|    base_value           | 9.8           |
|    gravity              | 9.8           |
| rollout/                |               |
|    ep_len_mean          | 272           |
|    ep_rew_mean          | 272           |
| time/                   |               |
|    fps                  | 978           |
|    iterations           | 17            |
|    time_elapsed         | 35            |
|    total_timesteps      | 34816         |
| train/                  |               |
|    approx_kl            | 0.0039687688  |
|    clip_fraction        | 0.0172        |
|    clip_range           | 0.2           |
|    entropy_loss         | -0.486        |
|    explained_variance   | -0.0044618845 |
|    learning_rate        | 0.0003        |
|    loss                 | 0.0416        |
|    n_updates            | 160           |
|    policy_gradient_loss | -0.00121      |
|    value_loss           | 0.815         |
-------------------------------------------
-------------------------------------------
| adaptive/               |               |
|    adaptation_factor    | 1             |
|    algorithm            | PPO           |
|    base_clip_range      | 0.2           |
|    base_lr              | 0.0003        |
|    clip_range           | 0.2           |
|    drift_magnitude      | 0             |
|    ent_coef             | 0             |
|    learning_rate        | 0.0003        |
| env/                    |               |
|    base_value           | 9.8           |
|    gravity              | 9.8           |
| rollout/                |               |
|    ep_len_mean          | 290           |
|    ep_rew_mean          | 290           |
| time/                   |               |
|    fps                  | 978           |
|    iterations           | 18            |
|    time_elapsed         | 37            |
|    total_timesteps      | 36864         |
| train/                  |               |
|    approx_kl            | 0.004021005   |
|    clip_fraction        | 0.0424        |
|    clip_range           | 0.2           |
|    entropy_loss         | -0.496        |
|    explained_variance   | -0.0005707741 |
|    learning_rate        | 0.0003        |
|    loss                 | 0.0045        |
|    n_updates            | 170           |
|    policy_gradient_loss | -0.0025       |
|    value_loss           | 0.506         |
-------------------------------------------
------------------------------------------
| adaptive/               |              |
|    adaptation_factor    | 1            |
|    algorithm            | PPO          |
|    base_clip_range      | 0.2          |
|    base_lr              | 0.0003       |
|    clip_range           | 0.2          |
|    drift_magnitude      | 0            |
|    ent_coef             | 0            |
|    learning_rate        | 0.0003       |
| env/                    |              |
|    base_value           | 9.8          |
|    gravity              | 9.8          |
| rollout/                |              |
|    ep_len_mean          | 307          |
|    ep_rew_mean          | 307          |
| time/                   |              |
|    fps                  | 977          |
|    iterations           | 19           |
|    time_elapsed         | 39           |
|    total_timesteps      | 38912        |
| train/                  |              |
|    approx_kl            | 0.0027827553 |
|    clip_fraction        | 0.00557      |
|    clip_range           | 0.2          |
|    entropy_loss         | -0.499       |
|    explained_variance   | 0.017850578  |
|    learning_rate        | 0.0003       |
|    loss                 | 0.0109       |
|    n_updates            | 180          |
|    policy_gradient_loss | 0.00014      |
|    value_loss           | 0.309        |
------------------------------------------
------------------------------------------
| adaptive/               |              |
|    adaptation_factor    | 1            |
|    algorithm            | PPO          |
|    base_clip_range      | 0.2          |
|    base_lr              | 0.0003       |
|    clip_range           | 0.2          |
|    drift_magnitude      | 0            |
|    ent_coef             | 0            |
|    learning_rate        | 0.0003       |
| env/                    |              |
|    base_value           | 9.8          |
|    gravity              | 9.8          |
| rollout/                |              |
|    ep_len_mean          | 325          |
|    ep_rew_mean          | 325          |
| time/                   |              |
|    fps                  | 977          |
|    iterations           | 20           |
|    time_elapsed         | 41           |
|    total_timesteps      | 40960        |
| train/                  |              |
|    approx_kl            | 0.0054618213 |
|    clip_fraction        | 0.0336       |
|    clip_range           | 0.2          |
|    entropy_loss         | -0.491       |
|    explained_variance   | 0.016227484  |
|    learning_rate        | 0.0003       |
|    loss                 | 0.0499       |
|    n_updates            | 190          |
|    policy_gradient_loss | -0.00154     |
|    value_loss           | 0.182        |
------------------------------------------
------------------------------------------
| adaptive/               |              |
|    adaptation_factor    | 1            |
|    algorithm            | PPO          |
|    base_clip_range      | 0.2          |
|    base_lr              | 0.0003       |
|    clip_range           | 0.2          |
|    drift_magnitude      | 0            |
|    ent_coef             | 0            |
|    learning_rate        | 0.0003       |
| env/                    |              |
|    base_value           | 9.8          |
|    gravity              | 9.8          |
| rollout/                |              |
|    ep_len_mean          | 341          |
|    ep_rew_mean          | 341          |
| time/                   |              |
|    fps                  | 979          |
|    iterations           | 21           |
|    time_elapsed         | 43           |
|    total_timesteps      | 43008        |
| train/                  |              |
|    approx_kl            | 0.0064038187 |
|    clip_fraction        | 0.0461       |
|    clip_range           | 0.2          |
|    entropy_loss         | -0.49        |
|    explained_variance   | 0.010578692  |
|    learning_rate        | 0.0003       |
|    loss                 | 0.0155       |
|    n_updates            | 200          |
|    policy_gradient_loss | -0.0024      |
|    value_loss           | 0.118        |
------------------------------------------
------------------------------------------
| adaptive/               |              |
|    adaptation_factor    | 1            |
|    algorithm            | PPO          |
|    base_clip_range      | 0.2          |
|    base_lr              | 0.0003       |
|    clip_range           | 0.2          |
|    drift_magnitude      | 0            |
|    ent_coef             | 0            |
|    learning_rate        | 0.0003       |
| env/                    |              |
|    base_value           | 9.8          |
|    gravity              | 9.8          |
| rollout/                |              |
|    ep_len_mean          | 355          |
|    ep_rew_mean          | 355          |
| time/                   |              |
|    fps                  | 980          |
|    iterations           | 22           |
|    time_elapsed         | 45           |
|    total_timesteps      | 45056        |
| train/                  |              |
|    approx_kl            | 0.0055532875 |
|    clip_fraction        | 0.0283       |
|    clip_range           | 0.2          |
|    entropy_loss         | -0.488       |
|    explained_variance   | 0.008029461  |
|    learning_rate        | 0.0003       |
|    loss                 | 0.0269       |
|    n_updates            | 210          |
|    policy_gradient_loss | -0.00139     |
|    value_loss           | 0.0735       |
------------------------------------------
------------------------------------------
| adaptive/               |              |
|    adaptation_factor    | 1            |
|    algorithm            | PPO          |
|    base_clip_range      | 0.2          |
|    base_lr              | 0.0003       |
|    clip_range           | 0.2          |
|    drift_magnitude      | 0            |
|    ent_coef             | 0            |
|    learning_rate        | 0.0003       |
| env/                    |              |
|    base_value           | 9.8          |
|    gravity              | 9.8          |
| rollout/                |              |
|    ep_len_mean          | 373          |
|    ep_rew_mean          | 373          |
| time/                   |              |
|    fps                  | 982          |
|    iterations           | 23           |
|    time_elapsed         | 47           |
|    total_timesteps      | 47104        |
| train/                  |              |
|    approx_kl            | 0.0019281623 |
|    clip_fraction        | 0.0118       |
|    clip_range           | 0.2          |
|    entropy_loss         | -0.482       |
|    explained_variance   | 0.0043172836 |
|    learning_rate        | 0.0003       |
|    loss                 | -0.00513     |
|    n_updates            | 220          |
|    policy_gradient_loss | -0.00168     |
|    value_loss           | 0.0451       |
------------------------------------------
------------------------------------------
| adaptive/               |              |
|    adaptation_factor    | 1            |
|    algorithm            | PPO          |
|    base_clip_range      | 0.2          |
|    base_lr              | 0.0003       |
|    clip_range           | 0.2          |
|    drift_magnitude      | 0            |
|    ent_coef             | 0            |
|    learning_rate        | 0.0003       |
| env/                    |              |
|    base_value           | 9.8          |
|    gravity              | 9.8          |
| rollout/                |              |
|    ep_len_mean          | 388          |
|    ep_rew_mean          | 388          |
| time/                   |              |
|    fps                  | 982          |
|    iterations           | 24           |
|    time_elapsed         | 50           |
|    total_timesteps      | 49152        |
| train/                  |              |
|    approx_kl            | 0.0015886406 |
|    clip_fraction        | 0.00425      |
|    clip_range           | 0.2          |
|    entropy_loss         | -0.493       |
|    explained_variance   | 0.0001616478 |
|    learning_rate        | 0.0003       |
|    loss                 | 0.00871      |
|    n_updates            | 230          |
|    policy_gradient_loss | 0.000282     |
|    value_loss           | 0.0286       |
------------------------------------------
------------------------------------------
| adaptive/               |              |
|    adaptation_factor    | 1.1          |
|    algorithm            | PPO          |
|    base_clip_range      | 0.2          |
|    base_lr              | 0.0003       |
|    clip_range           | 0.181        |
|    drift_magnitude      | 1.02         |
|    ent_coef             | 0            |
|    learning_rate        | 0.000331     |
| env/                    |              |
|    base_value           | 9.8          |
|    gravity              | 19.8         |
| rollout/                |              |
|    ep_len_mean          | 405          |
|    ep_rew_mean          | 405          |
| time/                   |              |
|    fps                  | 983          |
|    iterations           | 25           |
|    time_elapsed         | 52           |
|    total_timesteps      | 51200        |
| train/                  |              |
|    approx_kl            | 0.002607854  |
|    clip_fraction        | 0.0165       |
|    clip_range           | 0.2          |
|    entropy_loss         | -0.482       |
|    explained_variance   | -0.017317414 |
|    learning_rate        | 0.0003       |
|    loss                 | 0.0118       |
|    n_updates            | 240          |
|    policy_gradient_loss | -0.00114     |
|    value_loss           | 0.0187       |
------------------------------------------
------------------------------------------
| adaptive/               |              |
|    adaptation_factor    | 1.1          |
|    algorithm            | PPO          |
|    base_clip_range      | 0.2          |
|    base_lr              | 0.0003       |
|    clip_range           | 0.181        |
|    drift_magnitude      | 1.02         |
|    ent_coef             | 0            |
|    learning_rate        | 0.000331     |
| env/                    |              |
|    base_value           | 9.8          |
|    gravity              | 19.8         |
| rollout/                |              |
|    ep_len_mean          | 417          |
|    ep_rew_mean          | 417          |
| time/                   |              |
|    fps                  | 983          |
|    iterations           | 26           |
|    time_elapsed         | 54           |
|    total_timesteps      | 53248        |
| train/                  |              |
|    approx_kl            | 0.0014173903 |
|    clip_fraction        | 0.00425      |
|    clip_range           | 0.181        |
|    entropy_loss         | -0.474       |
|    explained_variance   | 0.0067103505 |
|    learning_rate        | 0.0003       |
|    loss                 | 0.32         |
|    n_updates            | 250          |
|    policy_gradient_loss | 0.000157     |
|    value_loss           | 23.9         |
------------------------------------------
------------------------------------------
| adaptive/               |              |
|    adaptation_factor    | 1.1          |
|    algorithm            | PPO          |
|    base_clip_range      | 0.2          |
|    base_lr              | 0.0003       |
|    clip_range           | 0.181        |
|    drift_magnitude      | 1.02         |
|    ent_coef             | 0            |
|    learning_rate        | 0.000331     |
| env/                    |              |
|    base_value           | 9.8          |
|    gravity              | 19.8         |
| rollout/                |              |
|    ep_len_mean          | 422          |
|    ep_rew_mean          | 422          |
| time/                   |              |
|    fps                  | 981          |
|    iterations           | 27           |
|    time_elapsed         | 56           |
|    total_timesteps      | 55296        |
| train/                  |              |
|    approx_kl            | 0.0012235395 |
|    clip_fraction        | 0.00112      |
|    clip_range           | 0.181        |
|    entropy_loss         | -0.465       |
|    explained_variance   | 0.062077224  |
|    learning_rate        | 0.0003       |
|    loss                 | 29.6         |
|    n_updates            | 260          |
|    policy_gradient_loss | -0.00177     |
|    value_loss           | 145          |
------------------------------------------
------------------------------------------
| adaptive/               |              |
|    adaptation_factor    | 1.1          |
|    algorithm            | PPO          |
|    base_clip_range      | 0.2          |
|    base_lr              | 0.0003       |
|    clip_range           | 0.181        |
|    drift_magnitude      | 1.02         |
|    ent_coef             | 0            |
|    learning_rate        | 0.000331     |
| env/                    |              |
|    base_value           | 9.8          |
|    gravity              | 19.8         |
| rollout/                |              |
|    ep_len_mean          | 431          |
|    ep_rew_mean          | 431          |
| time/                   |              |
|    fps                  | 980          |
|    iterations           | 28           |
|    time_elapsed         | 58           |
|    total_timesteps      | 57344        |
| train/                  |              |
|    approx_kl            | 0.0007116387 |
|    clip_fraction        | 0.000146     |
|    clip_range           | 0.181        |
|    entropy_loss         | -0.456       |
|    explained_variance   | 0.3196795    |
|    learning_rate        | 0.0003       |
|    loss                 | 53.8         |
|    n_updates            | 270          |
|    policy_gradient_loss | -0.00255     |
|    value_loss           | 125          |
------------------------------------------
-------------------------------------------
| adaptive/               |               |
|    adaptation_factor    | 1.1           |
|    algorithm            | PPO           |
|    base_clip_range      | 0.2           |
|    base_lr              | 0.0003        |
|    clip_range           | 0.181         |
|    drift_magnitude      | 1.02          |
|    ent_coef             | 0             |
|    learning_rate        | 0.000331      |
| env/                    |               |
|    base_value           | 9.8           |
|    gravity              | 19.8          |
| rollout/                |               |
|    ep_len_mean          | 437           |
|    ep_rew_mean          | 437           |
| time/                   |               |
|    fps                  | 978           |
|    iterations           | 29            |
|    time_elapsed         | 60            |
|    total_timesteps      | 59392         |
| train/                  |               |
|    approx_kl            | 0.00046830083 |
|    clip_fraction        | 0             |
|    clip_range           | 0.181         |
|    entropy_loss         | -0.454        |
|    explained_variance   | 0.6094485     |
|    learning_rate        | 0.0003        |
|    loss                 | 17.7          |
|    n_updates            | 280           |
|    policy_gradient_loss | -0.00168      |
|    value_loss           | 58            |
-------------------------------------------
------------------------------------------
| adaptive/               |              |
|    adaptation_factor    | 1.1          |
|    algorithm            | PPO          |
|    base_clip_range      | 0.2          |
|    base_lr              | 0.0003       |
|    clip_range           | 0.181        |
|    drift_magnitude      | 1.02         |
|    ent_coef             | 0            |
|    learning_rate        | 0.000331     |
| env/                    |              |
|    base_value           | 9.8          |
|    gravity              | 19.8         |
| rollout/                |              |
|    ep_len_mean          | 443          |
|    ep_rew_mean          | 443          |
| time/                   |              |
|    fps                  | 977          |
|    iterations           | 30           |
|    time_elapsed         | 62           |
|    total_timesteps      | 61440        |
| train/                  |              |
|    approx_kl            | 0.0007066197 |
|    clip_fraction        | 4.88e-05     |
|    clip_range           | 0.181        |
|    entropy_loss         | -0.451       |
|    explained_variance   | 0.73331606   |
|    learning_rate        | 0.0003       |
|    loss                 | 29.4         |
|    n_updates            | 290          |
|    policy_gradient_loss | -0.00245     |
|    value_loss           | 51           |
------------------------------------------
-----------------------------------------
| adaptive/               |             |
|    adaptation_factor    | 1.1         |
|    algorithm            | PPO         |
|    base_clip_range      | 0.2         |
|    base_lr              | 0.0003      |
|    clip_range           | 0.181       |
|    drift_magnitude      | 1.02        |
|    ent_coef             | 0           |
|    learning_rate        | 0.000331    |
| env/                    |             |
|    base_value           | 9.8         |
|    gravity              | 19.8        |
| rollout/                |             |
|    ep_len_mean          | 448         |
|    ep_rew_mean          | 448         |
| time/                   |             |
|    fps                  | 977         |
|    iterations           | 31          |
|    time_elapsed         | 64          |
|    total_timesteps      | 63488       |
| train/                  |             |
|    approx_kl            | 0.000961901 |
|    clip_fraction        | 0.00107     |
|    clip_range           | 0.181       |
|    entropy_loss         | -0.456      |
|    explained_variance   | 0.748714    |
|    learning_rate        | 0.0003      |
|    loss                 | 3.88        |
|    n_updates            | 300         |
|    policy_gradient_loss | -0.00336    |
|    value_loss           | 26.3        |
-----------------------------------------
-----------------------------------------
| adaptive/               |             |
|    adaptation_factor    | 1.1         |
|    algorithm            | PPO         |
|    base_clip_range      | 0.2         |
|    base_lr              | 0.0003      |
|    clip_range           | 0.181       |
|    drift_magnitude      | 1.02        |
|    ent_coef             | 0           |
|    learning_rate        | 0.000331    |
| env/                    |             |
|    base_value           | 9.8         |
|    gravity              | 19.8        |
| rollout/                |             |
|    ep_len_mean          | 452         |
|    ep_rew_mean          | 452         |
| time/                   |             |
|    fps                  | 978         |
|    iterations           | 32          |
|    time_elapsed         | 66          |
|    total_timesteps      | 65536       |
| train/                  |             |
|    approx_kl            | 0.003016898 |
|    clip_fraction        | 0.0118      |
|    clip_range           | 0.181       |
|    entropy_loss         | -0.441      |
|    explained_variance   | 0.79984987  |
|    learning_rate        | 0.0003      |
|    loss                 | 2.75        |
|    n_updates            | 310         |
|    policy_gradient_loss | -0.00584    |
|    value_loss           | 13.6        |
-----------------------------------------
-----------------------------------------
| adaptive/               |             |
|    adaptation_factor    | 1.1         |
|    algorithm            | PPO         |
|    base_clip_range      | 0.2         |
|    base_lr              | 0.0003      |
|    clip_range           | 0.181       |
|    drift_magnitude      | 1.02        |
|    ent_coef             | 0           |
|    learning_rate        | 0.000331    |
| env/                    |             |
|    base_value           | 9.8         |
|    gravity              | 19.8        |
| rollout/                |             |
|    ep_len_mean          | 452         |
|    ep_rew_mean          | 452         |
| time/                   |             |
|    fps                  | 977         |
|    iterations           | 33          |
|    time_elapsed         | 69          |
|    total_timesteps      | 67584       |
| train/                  |             |
|    approx_kl            | 0.006742385 |
|    clip_fraction        | 0.0625      |
|    clip_range           | 0.181       |
|    entropy_loss         | -0.429      |
|    explained_variance   | 0.5099288   |
|    learning_rate        | 0.0003      |
|    loss                 | 0.493       |
|    n_updates            | 320         |
|    policy_gradient_loss | -0.00669    |
|    value_loss           | 2.01        |
-----------------------------------------
------------------------------------------
| adaptive/               |              |
|    adaptation_factor    | 1.1          |
|    algorithm            | PPO          |
|    base_clip_range      | 0.2          |
|    base_lr              | 0.0003       |
|    clip_range           | 0.181        |
|    drift_magnitude      | 1.02         |
|    ent_coef             | 0            |
|    learning_rate        | 0.000331     |
| env/                    |              |
|    base_value           | 9.8          |
|    gravity              | 19.8         |
| rollout/                |              |
|    ep_len_mean          | 451          |
|    ep_rew_mean          | 451          |
| time/                   |              |
|    fps                  | 977          |
|    iterations           | 34           |
|    time_elapsed         | 71           |
|    total_timesteps      | 69632        |
| train/                  |              |
|    approx_kl            | 0.0064833853 |
|    clip_fraction        | 0.0535       |
|    clip_range           | 0.181        |
|    entropy_loss         | -0.42        |
|    explained_variance   | 0.6664177    |
|    learning_rate        | 0.0003       |
|    loss                 | 0.144        |
|    n_updates            | 330          |
|    policy_gradient_loss | -0.00427     |
|    value_loss           | 0.298        |
------------------------------------------
------------------------------------------
| adaptive/               |              |
|    adaptation_factor    | 1.1          |
|    algorithm            | PPO          |
|    base_clip_range      | 0.2          |
|    base_lr              | 0.0003       |
|    clip_range           | 0.181        |
|    drift_magnitude      | 1.02         |
|    ent_coef             | 0            |
|    learning_rate        | 0.000331     |
| env/                    |              |
|    base_value           | 9.8          |
|    gravity              | 19.8         |
| rollout/                |              |
|    ep_len_mean          | 451          |
|    ep_rew_mean          | 451          |
| time/                   |              |
|    fps                  | 976          |
|    iterations           | 35           |
|    time_elapsed         | 73           |
|    total_timesteps      | 71680        |
| train/                  |              |
|    approx_kl            | 0.0042797006 |
|    clip_fraction        | 0.0314       |
|    clip_range           | 0.181        |
|    entropy_loss         | -0.457       |
|    explained_variance   | 0.82130367   |
|    learning_rate        | 0.0003       |
|    loss                 | 5.25         |
|    n_updates            | 340          |
|    policy_gradient_loss | -0.00497     |
|    value_loss           | 10.5         |
------------------------------------------
------------------------------------------
| adaptive/               |              |
|    adaptation_factor    | 1.1          |
|    algorithm            | PPO          |
|    base_clip_range      | 0.2          |
|    base_lr              | 0.0003       |
|    clip_range           | 0.181        |
|    drift_magnitude      | 1.02         |
|    ent_coef             | 0            |
|    learning_rate        | 0.000331     |
| env/                    |              |
|    base_value           | 9.8          |
|    gravity              | 19.8         |
| rollout/                |              |
|    ep_len_mean          | 451          |
|    ep_rew_mean          | 451          |
| time/                   |              |
|    fps                  | 976          |
|    iterations           | 36           |
|    time_elapsed         | 75           |
|    total_timesteps      | 73728        |
| train/                  |              |
|    approx_kl            | 0.0013989096 |
|    clip_fraction        | 0.0154       |
|    clip_range           | 0.181        |
|    entropy_loss         | -0.442       |
|    explained_variance   | 0.8990128    |
|    learning_rate        | 0.0003       |
|    loss                 | 4.38         |
|    n_updates            | 350          |
|    policy_gradient_loss | -0.00165     |
|    value_loss           | 5.63         |
------------------------------------------
-----------------------------------------
| adaptive/               |             |
|    adaptation_factor    | 1.1         |
|    algorithm            | PPO         |
|    base_clip_range      | 0.2         |
|    base_lr              | 0.0003      |
|    clip_range           | 0.181       |
|    drift_magnitude      | 1.02        |
|    ent_coef             | 0           |
|    learning_rate        | 0.000331    |
| env/                    |             |
|    base_value           | 9.8         |
|    gravity              | 19.8        |
| rollout/                |             |
|    ep_len_mean          | 451         |
|    ep_rew_mean          | 451         |
| time/                   |             |
|    fps                  | 975         |
|    iterations           | 37          |
|    time_elapsed         | 77          |
|    total_timesteps      | 75776       |
| train/                  |             |
|    approx_kl            | 0.008606574 |
|    clip_fraction        | 0.108       |
|    clip_range           | 0.181       |
|    entropy_loss         | -0.436      |
|    explained_variance   | 0.9186714   |
|    learning_rate        | 0.0003      |
|    loss                 | 0.236       |
|    n_updates            | 360         |
|    policy_gradient_loss | -0.0116     |
|    value_loss           | 0.471       |
-----------------------------------------
-----------------------------------------
| adaptive/               |             |
|    adaptation_factor    | 1.1         |
|    algorithm            | PPO         |
|    base_clip_range      | 0.2         |
|    base_lr              | 0.0003      |
|    clip_range           | 0.181       |
|    drift_magnitude      | 1.02        |
|    ent_coef             | 0           |
|    learning_rate        | 0.000331    |
| env/                    |             |
|    base_value           | 9.8         |
|    gravity              | 19.8        |
| rollout/                |             |
|    ep_len_mean          | 451         |
|    ep_rew_mean          | 451         |
| time/                   |             |
|    fps                  | 974         |
|    iterations           | 38          |
|    time_elapsed         | 79          |
|    total_timesteps      | 77824       |
| train/                  |             |
|    approx_kl            | 0.015517237 |
|    clip_fraction        | 0.219       |
|    clip_range           | 0.181       |
|    entropy_loss         | -0.433      |
|    explained_variance   | 0.9687252   |
|    learning_rate        | 0.0003      |
|    loss                 | -0.00399    |
|    n_updates            | 370         |
|    policy_gradient_loss | -0.0158     |
|    value_loss           | 0.127       |
-----------------------------------------
------------------------------------------
| adaptive/               |              |
|    adaptation_factor    | 1.1          |
|    algorithm            | PPO          |
|    base_clip_range      | 0.2          |
|    base_lr              | 0.0003       |
|    clip_range           | 0.181        |
|    drift_magnitude      | 1.02         |
|    ent_coef             | 0            |
|    learning_rate        | 0.000331     |
| env/                    |              |
|    base_value           | 9.8          |
|    gravity              | 19.8         |
| rollout/                |              |
|    ep_len_mean          | 451          |
|    ep_rew_mean          | 451          |
| time/                   |              |
|    fps                  | 973          |
|    iterations           | 39           |
|    time_elapsed         | 82           |
|    total_timesteps      | 79872        |
| train/                  |              |
|    approx_kl            | 0.0064906115 |
|    clip_fraction        | 0.138        |
|    clip_range           | 0.181        |
|    entropy_loss         | -0.427       |
|    explained_variance   | 0.8194976    |
|    learning_rate        | 0.0003       |
|    loss                 | -0.0153      |
|    n_updates            | 380          |
|    policy_gradient_loss | -0.0125      |
|    value_loss           | 0.0252       |
------------------------------------------
-----------------------------------------
| adaptive/               |             |
|    adaptation_factor    | 1.1         |
|    algorithm            | PPO         |
|    base_clip_range      | 0.2         |
|    base_lr              | 0.0003      |
|    clip_range           | 0.181       |
|    drift_magnitude      | 1.02        |
|    ent_coef             | 0           |
|    learning_rate        | 0.000331    |
| env/                    |             |
|    base_value           | 9.8         |
|    gravity              | 19.8        |
| rollout/                |             |
|    ep_len_mean          | 451         |
|    ep_rew_mean          | 451         |
| time/                   |             |
|    fps                  | 972         |
|    iterations           | 40          |
|    time_elapsed         | 84          |
|    total_timesteps      | 81920       |
| train/                  |             |
|    approx_kl            | 0.004565657 |
|    clip_fraction        | 0.0693      |
|    clip_range           | 0.181       |
|    entropy_loss         | -0.429      |
|    explained_variance   | 0.68933094  |
|    learning_rate        | 0.0003      |
|    loss                 | -0.0327     |
|    n_updates            | 390         |
|    policy_gradient_loss | -0.011      |
|    value_loss           | 0.00519     |
-----------------------------------------
------------------------------------------
| adaptive/               |              |
|    adaptation_factor    | 1.1          |
|    algorithm            | PPO          |
|    base_clip_range      | 0.2          |
|    base_lr              | 0.0003       |
|    clip_range           | 0.181        |
|    drift_magnitude      | 1.02         |
|    ent_coef             | 0            |
|    learning_rate        | 0.000331     |
| env/                    |              |
|    base_value           | 9.8          |
|    gravity              | 19.8         |
| rollout/                |              |
|    ep_len_mean          | 451          |
|    ep_rew_mean          | 451          |
| time/                   |              |
|    fps                  | 972          |
|    iterations           | 41           |
|    time_elapsed         | 86           |
|    total_timesteps      | 83968        |
| train/                  |              |
|    approx_kl            | 0.0050306506 |
|    clip_fraction        | 0.064        |
|    clip_range           | 0.181        |
|    entropy_loss         | -0.415       |
|    explained_variance   | 0.29548502   |
|    learning_rate        | 0.0003       |
|    loss                 | -0.0215      |
|    n_updates            | 400          |
|    policy_gradient_loss | -0.00534     |
|    value_loss           | 0.00243      |
------------------------------------------
----------------------------------------
| adaptive/               |            |
|    adaptation_factor    | 1.1        |
|    algorithm            | PPO        |
|    base_clip_range      | 0.2        |
|    base_lr              | 0.0003     |
|    clip_range           | 0.181      |
|    drift_magnitude      | 1.02       |
|    ent_coef             | 0          |
|    learning_rate        | 0.000331   |
| env/                    |            |
|    base_value           | 9.8        |
|    gravity              | 19.8       |
| rollout/                |            |
|    ep_len_mean          | 451        |
|    ep_rew_mean          | 451        |
| time/                   |            |
|    fps                  | 971        |
|    iterations           | 42         |
|    time_elapsed         | 88         |
|    total_timesteps      | 86016      |
| train/                  |            |
|    approx_kl            | 0.00892523 |
|    clip_fraction        | 0.125      |
|    clip_range           | 0.181      |
|    entropy_loss         | -0.428     |
|    explained_variance   | 0.06317848 |
|    learning_rate        | 0.0003     |
|    loss                 | 0.0159     |
|    n_updates            | 410        |
|    policy_gradient_loss | -0.00633   |
|    value_loss           | 0.00143    |
----------------------------------------
-----------------------------------------
| adaptive/               |             |
|    adaptation_factor    | 1.1         |
|    algorithm            | PPO         |
|    base_clip_range      | 0.2         |
|    base_lr              | 0.0003      |
|    clip_range           | 0.181       |
|    drift_magnitude      | 1.02        |
|    ent_coef             | 0           |
|    learning_rate        | 0.000331    |
| env/                    |             |
|    base_value           | 9.8         |
|    gravity              | 19.8        |
| rollout/                |             |
|    ep_len_mean          | 451         |
|    ep_rew_mean          | 451         |
| time/                   |             |
|    fps                  | 970         |
|    iterations           | 43          |
|    time_elapsed         | 90          |
|    total_timesteps      | 88064       |
| train/                  |             |
|    approx_kl            | 0.00445882  |
|    clip_fraction        | 0.0666      |
|    clip_range           | 0.181       |
|    entropy_loss         | -0.413      |
|    explained_variance   | -0.13126326 |
|    learning_rate        | 0.0003      |
|    loss                 | -0.00881    |
|    n_updates            | 420         |
|    policy_gradient_loss | -0.00406    |
|    value_loss           | 0.000926    |
-----------------------------------------
-----------------------------------------
| adaptive/               |             |
|    adaptation_factor    | 1.1         |
|    algorithm            | PPO         |
|    base_clip_range      | 0.2         |
|    base_lr              | 0.0003      |
|    clip_range           | 0.181       |
|    drift_magnitude      | 1.02        |
|    ent_coef             | 0           |
|    learning_rate        | 0.000331    |
| env/                    |             |
|    base_value           | 9.8         |
|    gravity              | 19.8        |
| rollout/                |             |
|    ep_len_mean          | 451         |
|    ep_rew_mean          | 451         |
| time/                   |             |
|    fps                  | 971         |
|    iterations           | 44          |
|    time_elapsed         | 92          |
|    total_timesteps      | 90112       |
| train/                  |             |
|    approx_kl            | 0.00318875  |
|    clip_fraction        | 0.0254      |
|    clip_range           | 0.181       |
|    entropy_loss         | -0.391      |
|    explained_variance   | -0.20754552 |
|    learning_rate        | 0.0003      |
|    loss                 | 0.00694     |
|    n_updates            | 430         |
|    policy_gradient_loss | -0.00336    |
|    value_loss           | 0.000662    |
-----------------------------------------
------------------------------------------
| adaptive/               |              |
|    adaptation_factor    | 1.1          |
|    algorithm            | PPO          |
|    base_clip_range      | 0.2          |
|    base_lr              | 0.0003       |
|    clip_range           | 0.181        |
|    drift_magnitude      | 1.02         |
|    ent_coef             | 0            |
|    learning_rate        | 0.000331     |
| env/                    |              |
|    base_value           | 9.8          |
|    gravity              | 19.8         |
| rollout/                |              |
|    ep_len_mean          | 451          |
|    ep_rew_mean          | 451          |
| time/                   |              |
|    fps                  | 971          |
|    iterations           | 45           |
|    time_elapsed         | 94           |
|    total_timesteps      | 92160        |
| train/                  |              |
|    approx_kl            | 0.0038952713 |
|    clip_fraction        | 0.0463       |
|    clip_range           | 0.181        |
|    entropy_loss         | -0.392       |
|    explained_variance   | -0.23052394  |
|    learning_rate        | 0.0003       |
|    loss                 | -0.000661    |
|    n_updates            | 440          |
|    policy_gradient_loss | -0.00159     |
|    value_loss           | 0.000462     |
------------------------------------------
------------------------------------------
| adaptive/               |              |
|    adaptation_factor    | 1.1          |
|    algorithm            | PPO          |
|    base_clip_range      | 0.2          |
|    base_lr              | 0.0003       |
|    clip_range           | 0.181        |
|    drift_magnitude      | 1.02         |
|    ent_coef             | 0            |
|    learning_rate        | 0.000331     |
| env/                    |              |
|    base_value           | 9.8          |
|    gravity              | 19.8         |
| rollout/                |              |
|    ep_len_mean          | 451          |
|    ep_rew_mean          | 451          |
| time/                   |              |
|    fps                  | 969          |
|    iterations           | 46           |
|    time_elapsed         | 97           |
|    total_timesteps      | 94208        |
| train/                  |              |
|    approx_kl            | 0.0016858487 |
|    clip_fraction        | 0.0248       |
|    clip_range           | 0.181        |
|    entropy_loss         | -0.382       |
|    explained_variance   | -0.3011663   |
|    learning_rate        | 0.0003       |
|    loss                 | -0.000222    |
|    n_updates            | 450          |
|    policy_gradient_loss | -0.00141     |
|    value_loss           | 0.000357     |
------------------------------------------
------------------------------------------
| adaptive/               |              |
|    adaptation_factor    | 1.1          |
|    algorithm            | PPO          |
|    base_clip_range      | 0.2          |
|    base_lr              | 0.0003       |
|    clip_range           | 0.181        |
|    drift_magnitude      | 1.02         |
|    ent_coef             | 0            |
|    learning_rate        | 0.000331     |
| env/                    |              |
|    base_value           | 9.8          |
|    gravity              | 19.8         |
| rollout/                |              |
|    ep_len_mean          | 451          |
|    ep_rew_mean          | 451          |
| time/                   |              |
|    fps                  | 969          |
|    iterations           | 47           |
|    time_elapsed         | 99           |
|    total_timesteps      | 96256        |
| train/                  |              |
|    approx_kl            | 0.0051680664 |
|    clip_fraction        | 0.0753       |
|    clip_range           | 0.181        |
|    entropy_loss         | -0.377       |
|    explained_variance   | -0.10900521  |
|    learning_rate        | 0.0003       |
|    loss                 | -0.00373     |
|    n_updates            | 460          |
|    policy_gradient_loss | -0.00322     |
|    value_loss           | 0.000207     |
------------------------------------------
------------------------------------------
| adaptive/               |              |
|    adaptation_factor    | 1.1          |
|    algorithm            | PPO          |
|    base_clip_range      | 0.2          |
|    base_lr              | 0.0003       |
|    clip_range           | 0.181        |
|    drift_magnitude      | 1.02         |
|    ent_coef             | 0            |
|    learning_rate        | 0.000331     |
| env/                    |              |
|    base_value           | 9.8          |
|    gravity              | 19.8         |
| rollout/                |              |
|    ep_len_mean          | 459          |
|    ep_rew_mean          | 459          |
| time/                   |              |
|    fps                  | 968          |
|    iterations           | 48           |
|    time_elapsed         | 101          |
|    total_timesteps      | 98304        |
| train/                  |              |
|    approx_kl            | 0.0019118232 |
|    clip_fraction        | 0.0285       |
|    clip_range           | 0.181        |
|    entropy_loss         | -0.349       |
|    explained_variance   | -0.14734566  |
|    learning_rate        | 0.0003       |
|    loss                 | 0.00406      |
|    n_updates            | 470          |
|    policy_gradient_loss | -0.00203     |
|    value_loss           | 0.000187     |
------------------------------------------
------------------------------------------
| adaptive/               |              |
|    adaptation_factor    | 1            |
|    algorithm            | PPO          |
|    base_clip_range      | 0.2          |
|    base_lr              | 0.0003       |
|    clip_range           | 0.2          |
|    drift_magnitude      | 0            |
|    ent_coef             | 0            |
|    learning_rate        | 0.0003       |
| env/                    |              |
|    base_value           | 9.8          |
|    gravity              | 9.8          |
| rollout/                |              |
|    ep_len_mean          | 468          |
|    ep_rew_mean          | 468          |
| time/                   |              |
|    fps                  | 968          |
|    iterations           | 49           |
|    time_elapsed         | 103          |
|    total_timesteps      | 100352       |
| train/                  |              |
|    approx_kl            | 0.0036524143 |
|    clip_fraction        | 0.0416       |
|    clip_range           | 0.181        |
|    entropy_loss         | -0.362       |
|    explained_variance   | -0.0349586   |
|    learning_rate        | 0.0003       |
|    loss                 | 0.0392       |
|    n_updates            | 480          |
|    policy_gradient_loss | -0.000567    |
|    value_loss           | 0.000152     |
------------------------------------------
wandb: WARNING Symlinked 1 file into the W&B run directory; call wandb.save again to sync new files.
wandb: uploading history steps 831-977, summary, console lines 1390-1620; updating run metadata
wandb: uploading model.zip; uploading output.log; uploading wandb-summary.json
wandb: uploading model.zip; uploading output.log; uploading wandb-summary.json; uploading config.yaml; uploading logs/CartPole_gravity_jump_Adaptive_20251216_224147_0/events.out.tfevents.1765899818.hungchan-Precision-7560.1155515.0
wandb: uploading logs/CartPole_gravity_jump_Adaptive_20251216_224147_0/events.out.tfevents.1765899818.hungchan-Precision-7560.1155515.0
wandb: uploading history steps 978-1019, summary, console lines 1621-1625
wandb: 
wandb: Run history:
wandb: adaptive/adaptation_factor ▁▁▁▁▁▁▁▁▁▁▁▁▁▁▁▁▁▁▁▁███████████████████▁
wandb:   adaptive/base_clip_range ▁▁▁▁▁▁▁▁▁▁▁▁▁▁▁▁▁▁▁▁▁▁▁▁▁▁▁▁▁▁▁▁▁▁▁▁▁▁▁▁
wandb:           adaptive/base_lr ▁▁▁▁▁▁▁▁▁▁▁▁▁▁▁▁▁▁▁▁▁▁▁▁▁▁▁▁▁▁▁▁▁▁▁▁▁▁▁▁
wandb:        adaptive/clip_range ████████████████████▁▁▁▁▁▁▁▁▁▁▁▁▁▁▁▁▁▁▁█
wandb:   adaptive/drift_magnitude ▁▁▁▁▁▁▁▁▁▁▁▁▁▁▁▁▁▁▁▁███████████████████▁
wandb:          adaptive/ent_coef ▁▁▁▁▁▁▁▁▁▁▁▁▁▁▁▁▁▁▁▁▁▁▁▁▁▁▁▁▁▁▁▁▁▁▁▁▁▁▁▁
wandb:     adaptive/learning_rate ▁▁▁▁▁▁▁▁▁▁▁▁▁▁▁▁▁▁▁▁███████████████████▁
wandb:             env/base_value ▁▁▁▁▁▁▁▁▁▁▁▁▁▁▁▁▁▁▁▁▁▁▁▁▁▁▁▁▁▁▁▁▁▁▁▁▁▁▁▁
wandb:                env/gravity ▁▁▁▁▁▁▁▁▁▁▁▁▁▁▁▁▁▁▁▁███████████████████▁
wandb:                global_step ▁▁▁▂▂▂▃▃▃▃▃▃▃▃▄▄▄▄▄▄▅▅▅▅▆▆▆▆▆▆▇▇▇▇▇█████
wandb:                        +12 ...
wandb: 
wandb: Run summary:
wandb: adaptive/adaptation_factor 1
wandb:   adaptive/base_clip_range 0.2
wandb:           adaptive/base_lr 0.0003
wandb:        adaptive/clip_range 0.2
wandb:   adaptive/drift_magnitude 0
wandb:          adaptive/ent_coef 0
wandb:     adaptive/learning_rate 0.0003
wandb:             env/base_value 9.8
wandb:                env/gravity 9.8
wandb:                global_step 100352
wandb:                        +12 ...
wandb: 
wandb: 🚀 View run CartPole_gravity_jump_Adaptive_20251216_224147 at: https://wandb.ai/hungtrab-hanoi-university-of-science-and-technology/CartPole_Drift_Research/runs/gsqu89am
wandb: ⭐️ View project at: https://wandb.ai/hungtrab-hanoi-university-of-science-and-technology/CartPole_Drift_Research
wandb: Synced 6 W&B file(s), 0 media file(s), 0 artifact file(s) and 2 other file(s)
wandb: Find logs at: logs/CartPole_gravity_jump_Adaptive_20251216_224147/wandb/run-20251216_224336-gsqu89am/logs
>>> [DriftAdaptiveCallback] Training Ended
    Final LR: 0.000300
    Last Drift Magnitude: 0.0000
    Final Clip Range: 0.2000
Model saved locally to: models/CartPole_gravity_jump_Adaptive_20251216_224147.zip
